Authors	BMRB	CreatedAt	DOI	DepDate	Description	Disease	EMDB	IsPublic	Link	Method	Mutant	Name	PMID	Patient	Protein	Range	Residues	Resolution	RolePF	Tissue	UniprotId	UpdatedAt	resEnd	resStart
Zhou, Y., Sokratian, A., Xu, E., Viverette, E., Dillard, L., Yuan, Y., Li, J.Y., Matarangas, A., Bouvette, J., Borgnia, M., Bartesaghi, A., West, A.		1757502955776	10.1101/2022.07.13.499896	2022-5-24	CryoEM structure of amplified alpha-synuclein fibril class A type I with extended core from DLB case X	DLB	EMD-27093	true		ELECTRON MICROSCOPY		8CZ6		True	α-synuclein	15-97	15-97 (82)	3.2	P	Amplfied from CSF	P37840	1757688237017	97	15
Xiaodan, N. Ryan, P.M. Jiansen, J. Jennifer, C.L.		1757502955452	10.1016/j.jmb.2019.07.001	2019-5-1	Cryo-EM structure of the N-terminally acetylated C-terminal Alpha-synuclein truncation Ac1-103		EMD-20186	true		ELECTRON MICROSCOPY	N-TERMINALLY ACETYLATED	6OSM		False	α-synuclein	37-96	37-96 (59)	3.4	P		P37840	1757688236535	96	37
Tycko, R. Paravastu, A.	18129	1625063682431	10.1073/pnas.0806270105	2011-12-8	Structural Model for a 40-residue Beta-Amyloid Fibril with Three-Fold Symmetry, Positive Stagger			true		SOLID-STATE NMR		2LMP		False	Abeta40	9-40	9-40 (31)	10	P		P05067	1757688236411	40	9
Shi, Y., Murzin, A.G., Falcon, B., Epstein, A., Machin, J., Tempest, P., Newell, K.L., Vidal, R., Garringer, H.J., Sahara, N., Higuchi, M., Ghetti, B., Jang, M., Scheres, S.H.W., Goedert, M.		1625064960186	10.1007/s00401-021-02294-3	2021-3-24	Paired helical filament from primary age-related tauopathy brain	primary age-related tauopathy (PART)	EMD-12549	true		ELECTRON MICROSCOPY		7NRQ		True	Tau	304-380	304-380 (76)	2.76	P	Hippocampus,frontal/occipital/entorhinal cortex	P10636	1757688236693	380	304
Bansal, A., Schmidt, M., Faendrich, M.		1757502955495	10.1038/s41467-021-21129-z	2020-6-11	Amyloid fibril morphology i (in vitro) from murine SAA1.1 protein		EMD-11162	true		ELECTRON MICROSCOPY		6ZCF		False	serum amyloid A (SAA)	1-37	1-37 (36)	2.73	P		P05367	1757688236639	37	1
Frieg, B., Antonschmidt, L., Dienemann, C., Geraets, J.A., Najbauer, E.E., Matthes, D., de Groot, B.L., Andreas, L.B., Becker, S., Griesinger, C., Schroeder, G.F.		1757502955736	10.1038/s41467-022-34552-7	2022-7-11	Lipidic alpha-synuclein fibril - polymorph L1B	PD	EMD-15371	true		ELECTRON MICROSCOPY		8ADV		False	α-synuclein	1-99	1-99 (98)	2.98	P		P37840	1757688236973	99	1
C.QI, S.YANG, S.H.W.SCHERES, M.GOEDERT		1756106173306	10.1073/pnas.2306767120	2023-4-20	TMEM106B FOLD I-D FILAMENT FROM GUAM ALS/PDC	ALS/PDC	EMD-17176	true		ELECTRON MICROSCOPY		8OTE		True	TMEM106B	120-254	120-254 (134)	3.6	P	frontal cortex	Q9NUM4	1757688237132	254	120
S.LOVESTAM, D.LI, S.H.W.SCHERES, M.GOEDERT		1756106173433	10.1038/s41586-023-06788-w	2023-8-20	TAU - CTE-LIA13 (TAU INTERMEDIATE AMYLOID)		EMD-18284	true		ELECTRON MICROSCOPY		8Q9K		False	Tau	308-375	308-375 (67)	3.2	P		P10636	1757688237253	375	308
J.A.BALANA, A.B.NGUYEN, L.SAELICES, R.M.PRATT		1757502955796	10.1038/s41589-024-01551-2	2023-3-7	CRYO-EM STRUCTURE OF SERINE 87 O-GLCNAC-MODIFIED ALPHA-SYNUCLEIN FIBRILS		EMD-29980	true		ELECTRON MICROSCOPY	S85 O-GLCNAC	8GF7		False	α-synuclein	7-96	7-96 (89)	4.8	P		P37840	1757688237052	96	7
M.ZIELINSKI, F.S.PERALTA REYES, L.GREMER, M.PAGNON DE LA VEGA, C.ROEDER, T.V.HEIDLER, S.SYVAENEN, D.WILLBOLD, D.SEHLIN, M.INGELSSON, G.F.SCHROEDER		1757502956154		2024-05-26	CRYO-EM STRUCTURE OF AMYLOID-BETA FIBRILS CARRYING THE UPPSALA ABETAUPP(1-42)DELTA(19-24) MUTATION - POLYMORPH 2		EMD-50438	true		ELECTRON MICROSCOPY	UPPSALA MUTATION	9FH3		False	Abeta42	0-27	0-27 (27)	3.9	P		P05067	1757688237575	27	0
Cao, Q. Boyer, D.R. Sawaya, M.R. Eisenberg, D.S.		1625065019045	10.1038/s41594-019-0248-4	2018-11-14	SegA-sym, conformation of TDP-43 low complexity domain segment A sym		EMD-9339	true		ELECTRON MICROSCOPY		6N37		False	TDP43	312-347	312-347 (35)	3.8	P		Q13148	1757688236512	347	312
R.BUECKER, C.SEURING, C.CAZEY, K.VEITH, M.GARCIA-ALAI, K.GRUENEWALD, M.LANDAU		1756106173013	10.1038/s41467-022-32039-z	2022-01-19	AMYLOID FIBRIL FROM THE ANTIMICROBIAL PEPTIDE UPERIN 3.5		EMD-14167	true		ELECTRON MICROSCOPY		7QV5		False	uperin-3.5	1-17	1-17 (16)	3	F		P82042	1757688236798	17	1
Shi, Y., Zhang, W., Yang, Y., Murzin, A.G., Falcon, B., Kotecha, A., van Beers, M., Tarutani, A., Kametani, F., Garringer, H.J., Vidal, R., Hallinan, G.I., Lashley, T., Saito, Y., Murayama, S., Yoshida, M., Tanaka, H., Kakita, A., Ikeuchi, T., Robinson, A.C., Mann, D.M.A., Kovacs, G.G., Revesz, T., Ghetti, B., Hasegawa, M., Goedert, M., Scheres, S.H.W.		1646823188560	10.1038/s41586-021-03911-7	2021-7-15	Argyrophilic grain disease type 2 tau filament	Argyrophilic grain disease (AGD)	EMD-13227	true		ELECTRON MICROSCOPY		7P6E		True	Tau	274-381	274-381 (107)	3.4	P	brain	P10636	1757688236756	381	274
Heerde, T., Schmidt, M., Faendrich, M.		1757502955533	10.1038/s41467-021-27688-5	2021-6-15	Major seeded in vitro fibril morphology from murine SAA1.1 protein	AA amyloidosis	EMD-13089	true		ELECTRON MICROSCOPY		7OVT		True	serum amyloid A (SAA)	1-69	1-69 (68)	2.69	P	Liver tissue	P05367	1757688236731	69	1
Guerrero-Ferreira, R. Taylor, N.M.I. Mona, D. Ringler, P. Lauer, M.E. Riek, R. Britschgi, M. Stahlberg, H.		1757502955356	10.7554/eLife.36402	2018-7-26	Structure of alpha-synuclein fibrils		EMD-0148	true		ELECTRON MICROSCOPY		6H6B		False	α-synuclein	38-95	38-95 (57)	3.4	P		P37840	1757688236473	95	38
S.LOVESTAM, D.LI, S.H.W.SCHERES, M.GOEDERT		1756106173429	10.1038/s41586-023-06788-w	2023-8-20	TAU - CTE-MIA18 (TAU INTERMEDIATE AMYLOID)		EMD-18278	true		ELECTRON MICROSCOPY		8Q9E		False	Tau	308-379	308-379 (71)	2.97	P		P10636	1757688237240	379	308
M.WILKINSON, A.I.P.TAYLOR, Y.XU, P.CHAKRABORTY, A.BRINKWORTH, L.F.WILLIS, A.ZHURAVLEVA, N.A.RANSON, R.FOSTER, S.E.RADFORD		1757502956160	10.1021/jacs.4c16743	2024-10-03	WT-IAPP CRYO-EM STRUCTURE TYPE SS - CONTROL REACTION		EMD-51726	true		ELECTRON MICROSCOPY		9GZ6		False	Islet amyloid polypeptide (IAPP)	12-37	12-37 (25)	3.3	P		P10997	1757688237678	37	12
Shi, Y., Murzin, A.G., Falcon, B., Epstein, A., Machin, J., Tempest, P., Newell, K.L., Vidal, R., Garringer, H.J., Sahara, N., Higuchi, M., Ghetti, B., Jang, M., Scheres, S.H.W., Goedert, M.		1625064960208	10.1007/s00401-021-02294-3	2021-3-24	Paired helical filament from Alzheimer's disease with PET ligand APN-1607	AD	EMD-12551	true		ELECTRON MICROSCOPY		7NRV		True	Tau	304-380	304-380 (76)	3	P	Hippocampus,frontal/occipital/entorhinal cortex	P10636	1757688236712	380	304
Gallardo, R.U., Iadanza, M.G., Ranson, N.A., Radford, S.E.		1757502955497	10.1038/s41594-020-0496-3	2020-7-14	two-protofilament amyloid structure of S20G variant of human amylin (IAPP - islet amyloid polypeptide)		EMD-11382	true		ELECTRON MICROSCOPY	S20G	6ZRQ		False	Islet amyloid polypeptide (IAPP)	15-36	15-36 (21)	3.9	P		P10997	1757688236650	36	15
Lovestam, S.K.A., Schweighauser, M., Scheres, S.H.W.		1757502955515	10.1002/2211-5463.13110	2021-1-28	Type 2B alpha-synuclein filament seeded in vitro by filaments purified from Multiple Systems Atrophy Case 1	MSA	EMD-12267	true		ELECTRON MICROSCOPY		7NCI		True	α-synuclein	14-91	14-91 (77)	3.55	P	Seeded by MSA (putamen)	P37840	1757688236678	91	14
K.SICKING, M.AL-AZZANI, T.F.OUTEIRO, R.FERNANDEZ-BUSNADIEGO		1757502956175	10.1101/2025.02.07.25321793	2025-01-07	IN VITRO GROWN K58N ALPHA-SYNUCLEIN FIBRILS		EMD-52458	true		ELECTRON MICROSCOPY	K58N	9HXA		True	α-synuclein	36-97	36-97 (61)	3.7	P		P37840	1757688237695	97	36
K.HOU, P.GE, M.R.SAWAYA, D.S.EISENBERG		1756106173511	10.1038/s41586-025-09244-z	2024-03-20	FILAMENT OF TAU IN COMPLEX WITH D-TLKIVWS, A D-PEPTIDE THAT DISAGGREGATES ALZHEIMER'S PAIRED HELICAL FILAMENTS, DETERMINED BY CRYO-EM	AD	EMD-44185	true		ELECTRON MICROSCOPY		9B4M		True	Tau	304-380	304-380 (76)	3.1	P	brain	P10636	1757688237371	380	304
Lu, J. Qiang, W. Meredith, S.C. Yau, W. Schweiters, C.D. Tycko, R.	19009	1625063682454	10.1016/j.cell.2013.08.035	2013-2-5	40-residue beta-amyloid fibril derived from Alzheimer's disease brain	Sporadic AD		true		SOLID-STATE NMR		2M4J		True	Abeta40	1-40	1-40 (39)	20	P	occipital brain lobe	P05067	1757688236413	40	1
W.C.XIA, Y.P.SUN, C.LIU		1757502955854	10.1038/s41467-024-46898-1	2023-5-16	CRYO-EM STRUCTURE OF ALPHA-SYNUCLEIN PS87 FIBRIL		EMD-36203	true		ELECTRON MICROSCOPY	PS87	8JEY		False	α-synuclein	1-72	1-72 (71)	2.6	P		P37840	1757688237074	72	1
Yang, Y., Stern, M.A., Meunier, L.A., Liu, W., Cai, Y.Q., Ericsson, M., Liu, L., Selkoe, J.D., Goedert, M., Scheres, H.W.S.		1756106173172	10.1016/j.neuron.2023.04.007	2022-9-6	Type I amyloid-beta 42 filaments from high-spin supernatants of aqueous extracts from Alzheimer's disease brains | ABeta42	AD	EMD-15770	true		ELECTRON MICROSCOPY		8AZS		True	Abeta42	9-42	9-42 (33)	2.9	P	cortex (pooled tissue from frontal, parietal, and temporal lobes)	P05067	1757688236980	42	9
K.E.LIU, Y.Q.TAO, D.LI, C.LIU		1757502956034	10.1073/pnas.2321633121	2023-11-23	THT-BOUND E46K ALPHA-SYNUCLEIN FIBRILS		EMD-38097	true		ELECTRON MICROSCOPY	E46K	8X7B		False	α-synuclein	45-99	45-99 (54)	3	P		P37840	1757688237296	99	45
H.JEONG, Y.LIN, Y.-H.LEE		1756106173072		2022-04-25	GLUCAGON AMYLOID FIBRIL		EMD-33290	true	https://www.biorxiv.org/content/10.1101/2022.11.21.517306v1.full.pdf	ELECTRON MICROSCOPY		7XM8		False	Glucagon	1-29	1-29 (28)	3.9	F		P01275	1757688236915	29	1
Fitzpatrick, A.W.P., Stowell, M.H.B., Chang, A., Xiang, X., Wang, J., Lee, C., Arakhamia, T., Simjanoska, M., Wang, C., Carlomagno, Y., Zhang, G., Dhingra, S., Thierry, M., Perneel, J., Heeman, B., Forgrave, L.M., DeTure, M., DeMarco, M.L., Cook, C.N., Rademakers, R., Dickson, D., Petrucelli, L., Mackenzie, I.R.A.		1756106173044	10.1016/j.cell.2022.02.026	2022-2-19	TMEM106B(120-254) protofilament from frontotemporal lobar degeneration with TDP-43 pathology (FTLD-TDP) type A (case 1)	FTLD-TDP type A	EMD-26274	true		ELECTRON MICROSCOPY	N145,N151,N164,N183 GLYCOSYLATED	7U11		True	TMEM106B	120-254	120-254 (134)	3.2	P	frontal cortex	Q9NUM4	1757688236832	254	120
M.ZIELINSKI, F.S.PERALTA REYES, L.GREMER, S.SCHEMMERT, B.FRIEG, A.WILLUWEIT, L.DONNER, M.ELVERS, L.N.G.NILSSON, S.SYVANEN, D.SEHLIN, M.INGELSSON, D.WILLBOLD, G.F.SCHROEDER		1756106173265	10.1038/s41593-023-01484-4	2023-3-30	MURINE TYPE II ABETA FIBRIL FROM ARTE10 MOUSE		EMD-16949	true		ELECTRON MICROSCOPY		8OL5		True	Abeta42	12-42	12-42 (30)	3.4	P	ARTE10	P05067	1757688237113	42	12
S.ANSARI, Y.LI, K.K.FREDERICK		1757502956118	10.1101/2024.09.09.612142	2024-07-09	CRYO-EM STRUCTURE OF ACETYLATED ALPHA-SYNUCLEIN A53T FIBRIL - POLYMORPH B		EMD-45651	true		ELECTRON MICROSCOPY	A53T,N-TERM ACETYLATION	9CKL		False	α-synuclein	36-95	36-95 (59)	2.68	P		P37840	1757688237454	95	36
T.SCHULTE, V.SPERANZINI, A.CHAVES-SANJUAN, M.MILAZZO, S.RICAGNO		1756106173563	10.1038/s41467-024-50686-2	2024-5-10	ADDITIONAL CRYO-EM STRUCTURE OF CARDIAC AMYLOID AL59 - MIXED POLYMORPH	AL amyloidosis	EMD-50272	true		ELECTRON MICROSCOPY	1-118	9FAC		True	lamda-IgLC	1-117	1-117 (116)	3.9	P	cardiac  tissue		1757688237572	117	1
Q.Y.ZHAO, Y.Q.TAO, C.LIU, D.LI		1756106173254		2023-8-15	THE CRYO-EM STRUCTURE OF TYPE1 AMYLOID BETA 42 FIBRIL IN AD2 PATIENT.		EMD-37198	true		ELECTRON MICROSCOPY		8KF4		False	Abeta42	9-42	9-42 (33)	3	P		P05067	1757688237092	42	9
Shi, Y., Zhang, W., Yang, Y., Murzin, A.G., Falcon, B., Kotecha, A., van Beers, M., Tarutani, A., Kametani, F., Garringer, H.J., Vidal, R., Hallinan, G.I., Lashley, T., Saito, Y., Murayama, S., Yoshida, M., Tanaka, H., Kakita, A., Ikeuchi, T., Robinson, A.C., Mann, D.M.A., Kovacs, G.G., Revesz, T., Ghetti, B., Hasegawa, M., Goedert, M., Scheres, S.H.W.		1646823188475	10.1038/s41586-021-03911-7	2021-7-15	Globular glial tauopathy type 1 tau filament	Globular glial tauopathy (GGT)	EMD-13219	true		ELECTRON MICROSCOPY		7P66		True	Tau	272-379	272-379 (107)	3	P	brain	P10636	1757688236734	379	272
Paissoni, C. Camilloni, C.		1756106172687	10.1038/s41467-019-09133-w	2018-10-6	Cryo-EM structure of cardiac amyloid fibrils from an immunoglobulin light chain (AL) amyloidosis patient.	Systemic AL amyloidosis	EMD-0274	true		ELECTRON MICROSCOPY		6HUD		True	lamda-IgLC	1-105	1-105 (104)	4	P	Left ventricle heart tissue (patient AL55)		1757688236476	105	1
Fitzpatrick, A.W.P., Stowell, M.H.B., Chang, A., Xiang, X., Wang, J., Lee, C., Arakhamia, T., Simjanoska, M., Wang, C., Carlomagno, Y., Zhang, G., Dhingra, S., Thierry, M., Perneel, J., Heeman, B., Forgrave, L.M., DeTure, M., DeMarco, M.L., Cook, C.N., Rademakers, R., Dickson, D., Petrucelli, L., Mackenzie, I.R.A.		1756106173043	10.1016/j.cell.2022.02.026	2022-2-19	TMEM106B(120-254) protofilament from progressive supranuclear palsy (PSP) case 2	PSP	EMD-26273	true		ELECTRON MICROSCOPY	N145,N151,N164,N183 GLYCOSYLATED	7U10		True	TMEM106B	120-254	120-254 (134)	3	P	frontal cortex/caudate	Q9NUM4	1757688236831	254	120
S.LOVESTAM, D.LI, S.H.W.SCHERES, M.GOEDERT		1756106173408	10.1038/s41586-023-06788-w	2023-8-19	TAU - CTE-MIA4 (TAU INTERMEDIATE AMYLOID)		EMD-18263	true		ELECTRON MICROSCOPY		8Q8W		False	Tau	308-378	308-378 (70)	2.85	P		P10636	1757688237230	378	308
H.R.SAIBIL, J.MONISTROL		1757502956015	10.1038/s42003-025-07906-2	2024-1-23	ALPHA-SYNUCLEIN AMYLOID FIBRIL		EMD-19462	true		ELECTRON MICROSCOPY		8RRR		False	α-synuclein	14-97	14-97 (83)	3.4	P		P37840	1757688237275	97	14
S.LOVESTAM, D.LI, S.H.W.SCHERES, M.GOEDERT		1756106173431	10.1038/s41586-023-06788-w	2023-8-20	TAU - CTE-LIA5 (TAU INTERMEDIATE AMYLOID)		EMD-18280	true		ELECTRON MICROSCOPY		8Q9G		False	Tau	306-378	306-378 (72)	2.65	P		P10636	1757688237242	378	306
H.R.SAIBIL, J.MONISTROL		1757502956014	10.1038/s42003-025-07906-2	2024-1-18	ALPHA-SYNUCLEIN AMYLOID FIBRILS		EMD-19446	true		ELECTRON MICROSCOPY		8RQM		False	α-synuclein	37-96	37-96 (59)	3.2	P		P37840	1757688237275	96	37
V.PESCH, S.REITHOFER, L.MA, J.M.FLORES-FERNANDEZ, P.OEZDUEZENCILER, Y.BUSCH, Y.LIEN, O.RUDTKE, B.FRIEG, G.F.SCHROEDER, H.WILLE, G.TAMGUENEY		1757502955875	10.1093/brain/awae061	2023-4-12	CRYO-EM STRUCTURE OF THE WILD-TYPE ALPHA-SYNUCLEIN FIBRIL.		EMD-17111	true		ELECTRON MICROSCOPY		8OQI		False	α-synuclein	39-94	39-94 (55)	3.1	P		P37840	1757688237117	94	39
C.QI, S.H.W.SCHERES, G.MICHEL		1756106173547	10.1038/s41594-025-01498-5	2024-03-14	SF TYPE TAU FILAMENT FROM V337M MUTANT	FTD	EMD-19849	true		ELECTRON MICROSCOPY	V337M	9EO9		True	Tau	304-380	304-380 (76)	3.3	P	frontal cortex	P10636	1757688237516	380	304
M.R.HOQ, F.S.VAGO, S.R.BHARATH, W.JIANG		1756106173467	10.1038/s41594-024-01252-3	2023-4-10	TYPE IIIB BETA-AMYLOID 40 FILAMENTS FROM DOWN SYNDROME	Down Syndrome	EMD-40421	true		ELECTRON MICROSCOPY		8SEL		True	Abeta40	8-7	8-7 (-1)	3.8	P	frontal cortex	P05067	1757688237279	7	8
HSIAO, L.C., LEE, C.H., MAZMANIAN, K., YOSHIDA, M., ITO, G., MURATA, T., UTSUNOMIYA-TATE, N., HAINO, T., TATE, S.I., HSU, S.D.		1757502956179		2025-03-26	CRYO-EM STRUCTURE OF THE TYPE I AMYLOID-BETA 42 FIBRIL CONTAINING A D-ASP AT POSITIONS 7 AND 23		EMD-61304	true	https://doi.org/10.1016/j.jmb.2025.169092	ELECTRON MICROSCOPY	D-ASPARTATE 7,23	9JB1		False	Abeta42	9-42	9-42 (33)	2.5	P		P05067	1757688237711	42	9
K.E.LIU, Y.Q.TAO, D.LI, C.LIU		1757502956036	10.1073/pnas.2321633121	2023-11-24	CCA-BOUND E46K ALPHA-SYNUCLEIN FIBRILS		EMD-38106	true		ELECTRON MICROSCOPY	E46K	8X7P		False	α-synuclein	45-99	45-99 (54)	2.7	P		P37840	1757688237298	99	45
S.LOVESTAM, D.LI, S.H.W.SCHERES, M.GOEDERT		1756106173387	10.1038/s41586-023-06788-w	2023-8-18	TAU - AD-LIA2 (TAU INTERMEDIATE AMYLOID)		EMD-18249	true		ELECTRON MICROSCOPY		8Q88		False	Tau	304-379	304-379 (75)	2.95	P		P10636	1757688237214	379	304
G.E.MERZ, E.TSE, D.R.SOUTHWORTH		1756106173230	10.1038/s41467-023-38537-y	2023-01-17	ALZHEIMER'S DISEASE PAIRED-HELICAL FILAMENT IN COMPLEX WITH PET TRACER GTP-1	AD,FTD	EMD-29458	true		ELECTRON MICROSCOPY		8FUG		True	Tau	306-378	306-378 (72)	2.7	P	frontal cortex	P10636	1757688237039	378	306
WEI, Q., LIU, D., XIA, W., WANG, F., HUANG, L., ZHANG, J., WANG, X., XU, Z., HE, C., LI, W., SHI, X., WANG, C., LIU, Y., LIU, C., DONG, S.		1757502956191	10.1038/s41467-025-60978-w	2025-6-8	CRYO-EM STRUCTURE OF AMYLOID-BETA42-4B POLYMORPH 2		EMD-61945	true		ELECTRON MICROSCOPY	Y10 Β-GALNAC	9K0E		False	Abeta42	11-42	11-42 (31)	2.6	P		P05067	1757688237715	42	11
S.LOVESTAM, H.W.S.SCHERES		1756106173649		2025-04-30	TAU FILAMENTS SEEDED BY AD HOMOGENATE USING 0N3R C322S		EMD-53530	true	https://www.biorxiv.org/content/10.1101/2025.03.29.646137v1.full	ELECTRON MICROSCOPY	C322S	9R2H		True	Tau	316-434	316-434 (118)	2.6	P	seeded with AD homogenate	P10636	1757688237754	434	316
D.S.EISENBERG, J.LU, P.GE, D.R.BOYER		1757502955777	10.1016/j.jbc.2023.105531	2022-7-27	HNRNPA2 D290V LCD PM2		EMD-27728	true		ELECTRON MICROSCOPY	D290V	8DUW		False	HnRNPA2	263-316	263-316 (53)	3.2	P		P22626	1757688237031	316	263
K.SICKING, M.AL-AZZANI, T.F.OUTEIRO, R.FERNANDEZ-BUSNADIEGO		1757502956173	10.1101/2024.09.23.24313864	2024-11-20	IN VITRO GROWN WT ALPHA-SYNUCLEIN FIBRILS		EMD-52165	true		ELECTRON MICROSCOPY		9HGR		False	α-synuclein	14-94	14-94 (80)	2.7	P		P37840	1757688237694	94	14
Shi, Y., Zhang, W., Yang, Y., Murzin, A.G., Falcon, B., Kotecha, A., van Beers, M., Tarutani, A., Kametani, F., Garringer, H.J., Vidal, R., Hallinan, G.I., Lashley, T., Saito, Y., Murayama, S., Yoshida, M., Tanaka, H., Kakita, A., Ikeuchi, T., Robinson, A.C., Mann, D.M.A., Kovacs, G.G., Revesz, T., Ghetti, B., Hasegawa, M., Goedert, M., Scheres, S.H.W.		1646823188536	10.1038/s41586-021-03911-7	2021-7-15	Limbic-predominant neuronal inclusion body 4R tauopathy type 2 tau filament	Limbic-predominant (LMD) - GGT/PSP case	EMD-13225	true		ELECTRON MICROSCOPY		7P6C		True	Tau	272-379	272-379 (107)	3.3	P	brain	P10636	1757688236755	379	272
Seidler, P.M., Murray, K.A., Boyer, D.R., Ge, P., Sawaya, M.R., Eisenberg, D.S.		1756106173049	10.1038/s41467-022-32951-4	2022-4-15	Tau Paired Helical Filament from Alzheimer's Disease incubated 1 hr. with EGCG	AD	EMD-26664	true		ELECTRON MICROSCOPY		7UPF		True	Tau	306-379	306-379 (73)	3.3	P	Brain	P10636	1757688236838	379	306
C.QI, S.YANG, S.H.W.SCHERES, M.GOEDERT		1756106173307	10.1073/pnas.2306767120	2023-4-20	CTE TYPEI TAU FILAMENT FROM KII ALS/PDC	Kii ALS/PDC	EMD-17178	true		ELECTRON MICROSCOPY		8OTG		True	Tau	305-379	305-379 (74)	2.1	P	Temporal cortex	P10636	1757688237134	379	305
B.CAUGHEY, F.HOYT, P.ALAM, E.ARTIKIS, J.SOUKUP, A.HUGHSON, C.SCHWARTZ, B.RACE, K.BARBIAN		1757502956133	10.1007/s00401-024-02813-y	2024-9-16	GLYCOSYLATED CHRONIC WASTING DISEASE PRION FIBRIL	Chronic wasting disease	EMD-47021	true		ELECTRON MICROSCOPY		9DMZ		True	Prion Protein (PrP)	92-229	92-229 (137)	2.8	P	Deer brain	Q7JIQ1	1757688237494	229	92
S.LOVESTAM, D.LI, S.H.W.SCHERES, M.GOEDERT		1756106173428	10.1038/s41586-023-06788-w	2023-8-20	TAU - CTE-MIA14 (TAU INTERMEDIATE AMYLOID)		EMD-18276	true		ELECTRON MICROSCOPY		8Q9C		False	Tau	305-379	305-379 (74)	3.4	P		P10636	1757688237239	379	305
S.LOVESTAM, S.H.W.SCHERES, M.GOEDERT, D.LI		1756106173353	10.1038/s41586-023-06788-w	2023-8-1	TAU: AD-MIA1		EMD-18070	true		ELECTRON MICROSCOPY		8Q27		False	Tau	303-379	303-379 (76)	2.02	P		P10636	1757688237194	379	303
M.ZIELINSKI, F.S.PERALTA REYES, L.GREMER, S.SCHEMMERT, B.FRIEG, A.WILLUWEIT, L.DONNER, M.ELVERS, L.N.G.NILSSON, S.SYVANEN, D.SEHLIN, M.INGELSSON, D.WILLBOLD, G.F.SCHROEDER		1756106173267	10.1038/s41593-023-01484-4	2023-3-30	MURINE TYPE III ABETA FIBRIL FROM ARTE10 MOUSE		EMD-16960	true		ELECTRON MICROSCOPY		8OLO		True	Abeta42	10-40	10-40 (30)	3.5	P	ARTE10	P05067	1757688237115	40	10
Wilkinson, M., Gallardo, R., Radford, S.E., Ranson, N.A.		1757502955722	10.1038/s41467-023-36791-8	2022-6-21	beta-2-microglobulin DeltaN6 amyloid fibril form 2PFa		EMD-15222	true		ELECTRON MICROSCOPY	N6 DELETION	8A7O		False	Beta-2 microglobulin	6-93	6-93 (87)	3	P		P61769	1757688236959	93	6
C.QI, S.H.W.SCHERES, G.MICHEL		1756106173549	10.1038/s41594-025-01498-5	2024-3-14	PHF TYPE TAU FILAMENT FROM R406W MUTANT	FTD	EMD-19854	true		ELECTRON MICROSCOPY	R406W	9EOG		True	Tau	304-380	304-380 (76)	3	P	Frontal cortex	P10636	1757688237530	380	304
Ozcan, K.A., Hoq, M.R., Bharath, S.R., Jiang, W.		1757502955673	10.1007/s00401-022-02461-0	2022-4-8	Structure of Type II Prion filaments from Gerstmann-Straussler-Scheinker disease	Gerstmann–Sträussler–Scheinker(GSS)	EMD-26613	true		ELECTRON MICROSCOPY	F198S	7UN5		True	Prion Protein (PrP)	80-141	80-141 (61)	3.13	P	cerebellar  tissue	P04156	1757688236836	141	80
Y.W.LI, C.Y.ZHAO, F.LUO, Z.LIU, X.GUI, Z.LUO, X.ZHANG, D.LI, C.LIU, X.LI		1757502955334	10.1038/s41422-018-0075-x	2018-06-27	CRYO-EM STRUCTURE OF ALPHA-SYNUCLEIN FIBER		EMD-6988	true		ELECTRON MICROSCOPY		6A6B		False	α-synuclein	37-99	37-99 (62)	3.07	P		P37840	1757688236454	99	37
Li, B. Hatami, A. Ge, P. Murray, K.A. Sheth, P. Zhang, M. Nair, G. Sawaya, M.R. Zhu, C. Broad, M. Shin, W.S. Ye, S. John, V. Eisenberg, D.S. Zhou, Z.H. Jiang, L.		1757502955352	10.1038/s41467-018-05971-2	2018-3-23	Alpha Synuclein fibril formed by full length protein - Twister Polymorph		EMD-7619	true		ELECTRON MICROSCOPY		6CU8		False	α-synuclein	43-83	43-83 (40)	3.6	P		P37840	1757688236456	83	43
C.QI, S.YANG, S.H.W.SCHERES, M.GOEDERT		1756106173308	10.1073/pnas.2306767120	2023-4-20	TYPEII TAU FILAMENT FROM KII ALS/PDC	Kii ALS/PDC	EMD-17179	true		ELECTRON MICROSCOPY		8OTH		True	Tau	305-379	305-379 (74)	3.4	P	Temporal cortex	P10636	1757688237135	379	305
P.B.PFEIFFER, S.KARIMI-FARSIJANI, N.KUPFER, M.SCHMIDT, M.FAENDRICH		1756106173546	10.1038/s41467-024-49520-6	2024-03-08	AL AMYLOID FIBRIL FROM THE FOR103 LIGHT CHAIN	AL amyloidosis	EMD-19818	true		ELECTRON MICROSCOPY		9EME		True	lamda-IgLC	9-108	9-108 (99)	2.92	P	abdominal fat tissue	P37840	1757688237513	108	9
Y.BAEK, H.KIM, D.LEE, D.KIM, E.JO, S.-H.ROH, N.-C.HA		1757502956180	10.1073/pnas.2408582122	2024-08-27	CRYO-EM STRUCTURE OF HUMAN SOD1 (C6A/C111A) AMYLOID FILAMENT		EMD-61322	true		ELECTRON MICROSCOPY	C6A,C111A	9JBP		False	Superoxide dismutase (SOD1) [cu-zn]	1-41	1-41 (40)	3.18	P		P00441	1757688237712	41	1
S.LOVESTAM, D.LI, S.H.W.SCHERES, M.GOEDERT		1756106173443	10.1038/s41586-023-06788-w	2023-8-20	TAU - CTE-TYPE I (TAU INTERMEDIATE AMYLOID)		EMD-18286	true		ELECTRON MICROSCOPY		8Q9M		False	Tau	305-379	305-379 (74)	2.65	P		P10636	1757688237254	379	305
Xu, Q.H., Xia, W.C., Tao, Y.Q., Liu, C.		1757502955697	10.1021/jacs.2c10854	2022-7-21	Cryo-EM structure of Apo-alpha-syn fibril		EMD-33884	true		ELECTRON MICROSCOPY		7YK2		False	α-synuclein	37-99	37-99 (62)	2.8	P		P37840	1757688236919	99	37
M.WILKINSON, Y.XU, R.GALLARDO, S.E.RADFORD, N.A.RANSON		1757502955741	10.1016/j.cell.2023.11.025	2022-9-5	IAPP S20G PLATEAU-PHASE FIBRIL POLYMORPH 4PF-LJ		EMD-15756	true		ELECTRON MICROSCOPY	S20G	8AZ7		False	Islet amyloid polypeptide (IAPP)	9-37	9-37 (28)	2.9	P		P10997	1757688236979	37	9
M.WILKINSON, N.LOUROS, G.TSAKA, M.RAMAKERS, C.MORELLI, T.GARCIA, R.U.GALLARDO, S.D'HAEYER, V.GOOSSENS, D.AUDENAERT, D.R.THAL, N.A.RANSON, S.E.RADFORD, F.ROUSSEAU, J.SCHYMKOWITZ		1756106173264	10.1038/s41467-024-45429-2	2023-03-20	STRUCTURE OF THE TAU-PAM4 TYPE 1 AMYLOID FIBRIL		EMD-16876	true		ELECTRON MICROSCOPY		8OH2		False	Tau	350-362	350-362 (12)	2.6	P		P10636	1757688237094	362	350
Y.Q.TAO, Q.Y.ZHAO, C.LIU, D.LI		1757502955715		2022-7-31	THT-BOUND ALPHA-SYNUCLEIN FIBRILS CONFORMATION 2		EMD-33966	true		ELECTRON MICROSCOPY		7YNN		False	α-synuclein	37-97	37-97 (60)	2.9	P		P37840	1757688236951	97	37
Fitzpatrick, A.W.P. Debelouchina, G.T. Bayro, M.J. Clare, D.K. Caporini, M.A. Bajaj, V.S. Jaroniec, C.P. Wang, L. Ladizhansky, V. Muller, S. MacPhee, C.E. Waudby, C.A. Mott, H.R. de Simone, A. Knowles, T.P.J. Saibil, H.R. Vendruscolo, M. Orlova, E.V. Griffin, R.G. Dobson, C.M.	19062	1757502955296	10.1073/pnas.1219476110	2013-2-27	Atomic-resolution structure of a cross-beta protofilament			true		SOLID-STATE NMR		2M5N		False	Transthyretin (TTR)	1-11	1-11 (10)	20	P		P02766	1757688236414	11	1
Behr, T.S., Ryskeldi-Falcon, B.		1756106173189	10.1038/s41593-024-01801-5	2022-10-28	Tau Paired Helical Filament from Cellular Fraction of Alzheimer's disease brain	AD	EMD-16039	true		ELECTRON MICROSCOPY		8BGV		True	Tau	304-380	304-380 (76)	3.27	P	Brain	P10636	1757688236992	380	304
Lovestam, S., Schweighauser, M., Scheres, S.H.W.		1756106173023	10.1038/s41586-022-04650-z	2022-1-21	TMEM106B filaments with Fold I-d from Multiple system atrophy (case 18)	MSA	EMD-14176	true		ELECTRON MICROSCOPY		7QVF		True	TMEM106B	120-254	120-254 (134)	3.64	P	putamen	Q9NUM4	1757688236812	254	120
Zhou, Y., Sokratian, A., Xu, E., Viverette, E., Dillard, L., Yuan, Y., Li, J.Y., Matarangas, A., Bouvette, J., Borgnia, M., Bartesaghi, A., West, A.		1757502955762	10.1101/2022.07.13.499896	2022-5-24	CryoEM structures of amplified alpha-synuclein fibril class B mixed type I/II with extended core from DLB case II	DLB	EMD-27085	true		ELECTRON MICROSCOPY		8CYV		True	α-synuclein	15-97	15-97 (82)	3.5	P	Amplfied from CSF	P37840	1757688237010	97	15
B.A.NGUYEN, V.SINGH, L.SAELICES		1757502956018	10.1038/s41467-024-44820-3	2023-7-4	CRYO-EM STRUCTURE OF CARDIAC AMYLOID FIBRIL FROM A VARIANT ATTR I84S AMYLOIDOSIS PATIENT-3, WILD-TYPE MORPHOLOGY	ATTR	EMD-41171	true		ELECTRON MICROSCOPY	I84S	8TDN		True	Transthyretin (TTR)	11-124	11-124 (113)	3.1	P	Heart	P02766	1757688237280	124	11
K.SHARMA, J.SHENOY, A.LOQUET, M.SCHMIDT, M.FAENDRICH		1756106173450	10.1038/s41467-023-44489-0	2023-10-24	TDP-43 AMYLOID FIBRILS: MORPHOLOGY-1A		EMD-18715	true		ELECTRON MICROSCOPY		8QX9		False	TDP43	304-348	304-348 (44)	3.76	P		Q13148	1757688237262	348	304
