Authors	BMRB	CreatedAt	DOI	DepDate	Description	Disease	EMDB	IsPublic	Link	Method	Mutant	Name	PMID	Patient	Protein	Range	Residues	Resolution	RolePF	Tissue	UniprotId	UpdatedAt	resEnd	resStart
M.SCHWEIGHAUSER, A.G.MURZIN, J.MACDONALD, I.LAVENIR, R.A.CROWTHER, S.H.W.SCHERES, M.GOEDERT		1756106173423	10.1186/s40478-023-01658-y	2023-8-19	P301S TAU FILAMENTS FROM THE BRAINS OF PS19 TRANSGENIC MOUSE LINE		EMD-18268	true		ELECTRON MICROSCOPY	P301S	8Q92		True	Tau	271-364	271-364 (93)	3.05	P		P10636	1757688237234	364	271
Lovestam, S., Scheres, S.H.W.		1756106172993	10.7554/eLife.76494	2021-12-17	In vitro assembled 266/297 - 391 tau filaments with CuCl2 (12a)		EMD-14040	true		ELECTRON MICROSCOPY		7QKF		False	Tau	309-308	309-308 (-1)	2.83	P		P10636	1757688236777	308	309
C.QI, S.YANG, S.H.W.SCHERES, M.GOEDERT		1756106173303	10.1073/pnas.2306767120	2023-4-20	CTE TYPEIII TAU FILAMENT FROM GUAM ALS/PDC	Guam ALS/PDC	EMD-17173	true		ELECTRON MICROSCOPY		8OT9		True	Tau	305-379	305-379 (74)	3.4	P	Spinal cord	P10636	1757688237121	379	305
Lovestam, S.K.A., Schweighauser, M., Scheres, S.H.W.		1757502955516	10.1002/2211-5463.13110	2021-2-24	Type 2AB alpha-synuclein filament seeded in vitro by filaments purified from Multiple Systems Atrophy Case 1	MSA	EMD-12268	true		ELECTRON MICROSCOPY		7NCJ		True	α-synuclein	37-36	37-36 (-1)	4.23	P	Seeded by MSA (putamen)	P37840	1757688236691	36	37
Zhou, Y., Sokratian, A., Xu, E., Viverette, E., Dillard, L., Yuan, Y., Li, J.Y., Matarangas, A., Bouvette, J., Borgnia, M., Bartesaghi, A., West, A.		1757502955772	10.1101/2022.07.13.499896	2022-5-24	CryoEM structure of amplified alpha-synuclein fibril class B mixed type I/II with extended core from DLB case V	DLB	EMD-27088	true		ELECTRON MICROSCOPY		8CYY		True	α-synuclein	15-97	15-97 (82)	3.1	P	Amplfied from CSF	P37840	1757688237013	97	15
J.A.BALANA, A.B.NGUYEN, M.SAWAYA, A.G.MURZIN, L.SAELICES, R.M.PRATT		1757502956122	10.1038/s41589-024-01551-2	2024-08-13	CRYO-EM STRUCTURE OF SERINE 87 O-GLCNAC-MODIFIED ALPHA-SYNUCLEIN FIBRILS		EMD-29980	true		ELECTRON MICROSCOPY	S87 O-GLCNAC	9D5C		False	α-synuclein	1-96	1-96 (95)	4.8	P		P37840	1757688237473	96	1
Wilkinson, M., Gallardo, R., Radford, S.E., Ranson, N.A.		1757502955732	10.1038/s41467-023-36791-8	2022-6-21	beta-2-microglobulin V27M amyloid fibril form 4PF		EMD-15224	true		ELECTRON MICROSCOPY	V27M	8A7Q		False	Beta-2 microglobulin	21-84	21-84 (63)	2.8	P		P61769	1757688236961	84	21
S.LOVESTAM, D.LI, S.H.W.SCHERES, M.GOEDERT		1756106173355	10.1038/s41586-023-06788-w	2023-8-2	TAU - AD-MIA4		EMD-18112	true		ELECTRON MICROSCOPY		8Q2L		False	Tau	307-378	307-378 (71)	2.2	P		P10636	1757688237196	378	307
Li, B. Hatami, A. Ge, P. Murray, K.A. Sheth, P. Zhang, M. Nair, G. Sawaya, M.R. Zhu, C. Broad, M. Shin, W.S. Ye, S. John, V. Eisenberg, D.S. Zhou, Z.H. Jiang, L.		1757502955351	10.1038/s41467-018-05971-2	2018-3-23	Alpha Synuclein fibril formed by full length protein - Rod Polymorph		EMD-7618	true		ELECTRON MICROSCOPY		6CU7		False	α-synuclein	38-97	38-97 (59)	3.5	P		P37840	1757688236455	97	38
S.LOVESTAM, D.LI, S.H.W.SCHERES, M.GOEDERT		1756106173425	10.1038/s41586-023-06788-w	2023-8-20	TAU - CTE-MIA8 (TAU INTERMEDIATE AMYLOID)		EMD-18271	true		ELECTRON MICROSCOPY		8Q98		False	Tau	305-379	305-379 (74)	1.75	P		P10636	1757688237236	379	305
Zhang, S.Q., Li, X., Liu, C.		1756106173149	10.1016/j.isci.2022.105645	2022-8-3	Cryo-EM structure of amyloid fibril formed by tau (297-391)		EMD-33999	true		ELECTRON MICROSCOPY		7YPG		False	Tau	304-362	304-362 (58)	2.5	P		P10636	1757688236955	362	304
B.A.NGUYEN, L.SAELICES		1757502955796	10.1038/s42003-024-06588-6	2023-2-28	CARDIAC AMYLOID FIBRILS EXTRACTED FROM A WILD-TYPE ATTR AMYLOIDOSIS PATIENT	ATTR	EMD-29920	true		ELECTRON MICROSCOPY		8GBR		True	Transthyretin (TTR)	11-124	11-124 (113)	3.4	P	Heart	P02766	1757688237051	124	11
Fitzpatrick, A.W.P., Stowell, M.H.B., Chang, A., Xiang, X., Wang, J., Lee, C., Arakhamia, T., Simjanoska, M., Wang, C., Carlomagno, Y., Zhang, G., Dhingra, S., Thierry, M., Perneel, J., Heeman, B., Forgrave, L.M., DeTure, M., DeMarco, M.L., Cook, C.N., Rademakers, R., Dickson, D., Petrucelli, L., Mackenzie, I.R.A.		1756106173034	10.1016/j.cell.2022.02.026	2022-2-19	High-resolution map of tau filament from progressive supranuclear palsy (PSP) case 1	PSP	EMD-26268	true		ELECTRON MICROSCOPY		7U0Z		True	Tau	272-381	272-381 (109)	4.2	P	Caudate	P10636	1757688236830	381	272
E.TSE, U.GHOSH, C.CONDELLO, D.SOUTHWORTH		1756106173525	10.1186/s40478-024-01806-y	2024-5-22	PAIRED HELICAL FILAMENTS PURIFIED FROM DOWN SYNDROME INDIVIDUAL BRAIN TISSUE APPLIED TO GRAPHENE OXIDE ANTIBODY AFFINITY GRIDS	Down Syndrome	EMD-45008	true		ELECTRON MICROSCOPY		9BXQ		True	Tau	304-380	304-380 (76)	3.1	P	frontal cortex	P10636	1757688237410	380	304
Xu, Q.H., Xia, W.C., Tao, Y.Q., Liu, C.		1757502955697	10.1021/jacs.2c10854	2022-7-22	Cryo-EM structure of dLAG3-alpha-syn fibril		EMD-33890	true		ELECTRON MICROSCOPY		7YK8		False	α-synuclein	14-99	14-99 (85)	2.8	P		P37840	1757688236919	99	14
Cerofolini, L., Ravera, E., Bologna, S., Wiglenda, T., Boddrich, A., Purfurst, B., Benilova, A., Korsak, M., Gallo, G., Rizzo, D., Gonnelli, L., Fragai, M., De Strooper, B., Wanker, E.E., Luchinat, C.	34456	1625063682506	10.1039/d0cc02463e	2019-11-21	Mixing Abeta(1-40) and Abeta(1-42) peptides generates unique amyloid fibrils			true		SOLID-STATE NMR		6TI7		False	Abeta40	11-42	11-42 (31)	4	P		P05067	1757688236556	42	11
Guerrero-Ferreira, R. Taylor, N.M.I. Arteni, A.A. Melki, R. Meier, B.H. Bockmann, A. Bousset, L. Stahlberg, H.		1757502955472	10.7554/eLife.48907	2019-5-22	cryo-em structure of alpha-synuclein fibril polymorph 2A		EMD-4994	true		ELECTRON MICROSCOPY		6RT0		False	α-synuclein	14-97	14-97 (83)	3.1	P		P37840	1757688236551	97	14
M.SCHWEIGHAUSER, Y.SHI, A.G.MURZIN, H.J.GARRINGER, R.VIDAL, J.R.MURRELL, M.E.ERRO, H.SEELAAR, I.FERRER, J.C.VAN SWIETEN, B.GHETTI, S.H.W.SCHERES, M.GOEDERT		1756106173571	10.1038/s41594-025-01575-9	2024-8-13	P301T TYPE II TAU FILAMENTS FROM HUMAN BRAIN	FTD	EMD-51325	true		ELECTRON MICROSCOPY	P301T	9GG6		True	Tau	269-364	269-364 (95)	3.36	P	temporal cortex	P10636	1757688237677	364	269
S.LOVESTAM, D.LI, S.H.W.SCHERES, M.GOEDERT		1756106173444	10.1038/s41586-023-06788-w	2023-8-28	TAU - AD-LIA8 (TAU INTERMEDIATE AMYLOID)		EMD-18331	true		ELECTRON MICROSCOPY		8QCP		False	Tau	304-379	304-379 (75)	3.21	P		P10636	1757688237256	379	304
Wu, X.L., Hu, H., Zhang, J., Dong, X.Q., Wang, J., Schwieters, C., Wang, H.Y., Lu, J.X.	36243	1756106172688	10.1038/s41467-021-21881-2	2019-3-26	Mouse receptor-interacting protein kinase 3 (RIP3) amyloid structure by solid-state NMR			true		SOLID-STATE NMR		6JPD		False	RIPK3	1-21	1-21 (20)	10	F		Q9QZL0	1757688236477	21	1
N.L.YAN, F.CANDIDO, E.TSE, A.A.MELO, D.R.SOUTHWORTH, G.E.MERZ		1757502956115	10.1002/1873-3468.15048	2024-6-24	STRUCTURE OF TYPE I-2 ALPHA-SYNUCLEIN FILAMENT FROM MULTIPLE SYSTEM ATROPHY	MSA	EMD-45465	true		ELECTRON MICROSCOPY		9CDA		True	α-synuclein	14-100	14-100 (86)	3.3	P	Freshly frozen cerebellum tissue	P37840	1757688237434	100	14
Fitzpatrick, A.W.P. Falcon, B. He, S. Murzin, A.G. Murshudov, G. Garringer, H.G. Crowther, R.A. Ghetti, B. Goedert, M. Scheres, S.H.W.		1625064960067	10.1038/nature23002	2017-5-24	Straight filament in Alzheimer's disease brain	AD	EMD-3743	true		ELECTRON MICROSCOPY		5O3T		True	Tau	306-378	306-378 (72)	3.4	P	frontal and temporal cortex	P10636	1757688236452	378	306
Lovestam, S., Schweighauser, M., Scheres, S.H.W.		1756106173026	10.1038/s41586-022-04650-z	2022-1-25	TMEM106B filaments with Fold III from Multiple system atrophy (case 17)	MSA	EMD-14189	true		ELECTRON MICROSCOPY		7QWM		True	TMEM106B	120-254	120-254 (134)	2.76	P	putamen	Q9NUM4	1757688236815	254	120
C.QI, H.W.S.SCHERES, M.GOEDERT		1756106173550	10.1007/s00401-024-02741-x	2024-3-24	CTE TYPE I TAU FILAMENT FROM VACUOLAR TAUOPATHY	Vacuolar Tauopathy	EMD-19926	true		ELECTRON MICROSCOPY	D395G	9ERM		True	Tau	305-379	305-379 (74)	2.3	P	Frontal and temporal cortices	P10636	1757688237533	379	305
L.FREY, B.M.QURESHI, W.KWIATKOWSKI, D.RHYNER, J.GREENWALD, R.RIEK		1757502955913	10.7554/eLife.93562	2023-6-24	CRYO EM STRUCTURE OF THE TYPE 5A POLYMORPH OF ALPHA-SYNUCLEIN.		EMD-17726	true		ELECTRON MICROSCOPY	ACETYLATED N-TERMINAL METHIONINE	8PK4		False	α-synuclein	2-96	2-96 (94)	3.3	P		P37840	1757688237154	96	2
B.A.NGUYEN, L.SAELICES		1757502955779	10.1038/s42003-024-06588-6	2022-8-24	CRYO-EM STRUCTURE OF CARDIAC AMYLOID FIBRIL FROM A VARIANT ATTR P24S AMYLOIDOSIS PATIENT	ATTR	EMD-26692	true		ELECTRON MICROSCOPY	P24S	8E7I		True	Transthyretin (TTR)	12-123	12-123 (111)	3.65	P	Heart	P02766	1757688237033	123	12
P.DUAN, A.J.DREGNI, H.XU, L.CHANGOLKAR, V.M.-Y.LEE, M.HONG		1756106173530	10.1016/j.jbc.2024.107730	2024-7-1	ALZHEIMER'S DISEASE SEEDED 0N3R TAU FIBRILS		EMD-45588	true		ELECTRON MICROSCOPY		9CGX		True	Tau	307-380	307-380 (73)	2.97	P	seeded with AD sarkosyl insoluble tau pooled from five neuropathologically confirmed cases of AD	P10636	1757688237436	380	307
B.A.NGUYEN, L.SAELICES		1757502955795	10.1038/s42003-024-06588-6	2023-2-21	CARDIAC AMYLOID FIBRILS EXTRACTED FROM A WILD-TYPE ATTR AMYLOIDOSIS PATIENT	ATTR	EMD-29874	true		ELECTRON MICROSCOPY		8G9R		True	Transthyretin (TTR)	11-123	11-123 (112)	3.28	P	Heart	P02766	1757688237050	123	11
Tao, Y.Q., Sun, Y.P., Xia, W.C., Zhao, Q.Y., Liu, C., Li, D.		1757502955680	10.1038/s41467-022-31790-7	2021-8-12	Heparin-remodelled alpha-synuclein fibrils		EMD-31708	true		ELECTRON MICROSCOPY		7V4D		False	α-synuclein	37-94	37-94 (57)	3.5	P		P37840	1757688236851	94	37
Lovestam, S., Scheres, S.H.W.		1756106172986	10.7554/eLife.76494	2021-12-17	In vitro assembled tau filaments into Quadruple Helical Filaments type 1 (2c)		EMD-14023	true		ELECTRON MICROSCOPY		7QJV		False	Tau	304-378	304-378 (74)	3.29	P		P10636	1757688236761	378	304
P.B.PFEIFFER, S.BANERJEE, M.SCHMIDT, M.FAENDRICH		1756106173452	10.1038/s41467-024-49520-6	2023-11-13	AL AMYLOID FIBRIL FROM THE FOR010 LIGHT CHAIN	AL amyloidosis	EMD-18881	true		ELECTRON MICROSCOPY		8R47		True	lamda-IgLC	13-106	13-106 (93)	2.25	P	abdominal fat tissue		1757688237272	106	13
Arakhamia, T. Lee, C.E. Carlomagno, Y. Duong, D.M. Kundinger, S.R. Wang, K. Williams, D. DeTure, M. Dickson, D.W. Cook, C.N. Seyfried, N.T. Petrucelli, L. Fitzpatrick, A.W.P.		1625064960167	10.1016/j.cell.2020.01.027	2020-1-9	Doublet Tau Fibril from Corticobasal Degeneration Human Brain Tissue	corticobasal degeneration (CBD)	EMD-21200	true		ELECTRON MICROSCOPY		6VH7		True	Tau	274-380	274-380 (106)	3.8	P	medial frontal cortex	P10636	1757688236578	380	274
Lovestam, S., Scheres, S.H.W.		1756106173006	10.7554/eLife.76494	2021-12-17	In vitro assembled 266-391 S356D tau filaments with NaCl (45a)		EMD-14047	true		ELECTRON MICROSCOPY		7QKM		False	Tau	274-328	274-328 (54)	2.66	P		P10636	1757688236782	328	274
Chen, E.H.-L., Kao, S.-W., Lee, C.-H., Huang, J.Y.C., Chen, R.P.-Y., Wu, K.-P.		1757502955696	10.1021/jacs.2c05479	2022-6-28	CryoEM tetra protofilament structure of the hamster prion 108-144 fibril		EMD-33719	true		ELECTRON MICROSCOPY		7YAT		False	Prion Protein (PrP)	119-143	119-143 (24)	2.2	P		P04273	1757688236918	143	119
S.LOVESTAM, D.LI, S.H.W.SCHERES, M.GOEDERT		1756106173424	10.1038/s41586-023-06788-w	2023-8-20	TAU - CTE-MIA9 (TAU INTERMEDIATE AMYLOID)		EMD-18270	true		ELECTRON MICROSCOPY		8Q97		False	Tau	308-378	308-378 (70)	2.99	P		P10636	1757688237235	378	308
S.LOVESTAM, D.LI, S.H.W.SCHERES, M.GOEDERT		1756106173429	10.1038/s41586-023-06788-w	2023-8-20	TAU - CTE-MIA15 (TAU INTERMEDIATE AMYLOID)		EMD-18277	true		ELECTRON MICROSCOPY		8Q9D		False	Tau	305-379	305-379 (74)	3.16	P		P10636	1757688237240	379	305
B.FRIEG, M.HAN, K.GILLER, C.DIENEMANN, D.RIEDEL, S.BECKER, L.B.ANDREAS, C.GRIESINGER, G.F.SCHROEDER		1757502955898	10.1038/s41467-023-43822-x	2023-4-27	LIPIDIC AMYLOID-BETA(1-40) FIBRIL - POLYMORPH L3		EMD-17234	true		ELECTRON MICROSCOPY		8OWD		False	Abeta40	1-40	1-40 (39)	3.28	P		P05067	1757688237138	40	1
Murray, D.T. Kato, M. Lin, Y. Thurber, K. Hung, I. McKnight, S. Tycko, R.	30304	1757502955333	10.1016/j.cell.2017.08.048	2017-6-8	Molecular structure of FUS low sequence complexity domain protein fibrils			true		SOLID-STATE NMR		5W3N		False	FUS	37-97	37-97 (60)	20	P		P35637	1757688236454	97	37
S.LOVESTAM, D.LI, S.H.W.SCHERES, M.GOEDERT		1756106173445	10.1038/s41586-023-06788-w	2023-8-28	TAU - CTE-MIA12 (TAU INTERMEDIATE AMYLOID)		EMD-18333	true		ELECTRON MICROSCOPY		8QCR		False	Tau	308-375	308-375 (67)	2.75	P		P10636	1757688237257	375	308
Fitzpatrick, A.W.P., Stowell, M.H.B., Chang, A., Xiang, X., Wang, J., Lee, C., Arakhamia, T., Simjanoska, M., Wang, C., Carlomagno, Y., Zhang, G., Dhingra, S., Thierry, M., Perneel, J., Heeman, B., Forgrave, L.M., DeTure, M., DeMarco, M.L., Cook, C.N., Rademakers, R., Dickson, D., Petrucelli, L., Mackenzie, I.R.A.		1756106173045	10.1016/j.cell.2022.02.026	2022-2-19	TMEM106B(120-254) singlet amyloid fibril from frontotemporal lobar degeneration with TDP-43 pathology (FTLD-TDP) type A (case 2)	FTLD-TDP type A	EMD-26275	true		ELECTRON MICROSCOPY	N145,N151,N164,N183 GLYCOSYLATED	7U12		True	TMEM106B	120-254	120-254 (134)	3.5	P	frontal cortex	Q9NUM4	1757688236833	254	120
Sun, Y.P., Long, H.F., Xia, W.C., Liu, C.		1757502955499	10.1038/s41467-021-26433-2	2021-1-27	CryoEM structure of G51D alpha-synuclein amyloid fibril		EMD-30931	true		ELECTRON MICROSCOPY	G51D	7E0F		False	α-synuclein	50-98	50-98 (48)	3.02	P		P37840	1757688236654	98	50
Lovestam, S., Scheres, S.H.W.		1756106173013	10.7554/eLife.76494	2021-12-19	In vitro assembled tau filaments with structures like Paired Helical Filaments from Alzheimer's Disease		EMD-14063	true		ELECTRON MICROSCOPY		7QL4		False	Tau	304-379	304-379 (75)	3.2	P		P10636	1757688236797	379	304
M.WILKINSON, N.LOUROS, G.TSAKA, M.RAMAKERS, C.MORELLI, T.GARCIA, R.U.GALLARDO, S.D'HAEYER, V.GOOSSENS, D.AUDENAERT, D.R.THAL, N.A.RANSON, S.E.RADFORD, F.ROUSSEAU, J.SCHYMKOWITZ		1756106173264	10.1038/s41467-024-45429-2	2023-03-21	STRUCTURE OF THE FMOC-TAU-PAM4 TYPE 2 AMYLOID FIBRIL		EMD-16881	true		ELECTRON MICROSCOPY		8OHI		False	Tau	350-362	350-362 (12)	2.8	P		P10636	1757688237110	362	350
Cao, Q., Boyer, D.R., Sawaya, M.R., Eisenberg, D.S.		1757502955511	10.1038/s41594-021-00646-x	2021-3-25	Cryo-EM structure of human islet amyloid polypeptide (hIAPP, or amylin) fibrils seeded by patient extracted fibrils, polymorph 3	T2D	EMD-23688	true		ELECTRON MICROSCOPY		7M64		True	Islet amyloid polypeptide (IAPP)	13-37	13-37 (24)	4	P	seeded by islet cells pancreatic tissue	P10997	1757688236672	37	13
Y.Q.TAO, C.LIU, D.LI		1757502956176	10.1073/pnas.2321633121	2024-6-25	POLYPHOSPHATE BOUND ALPHA-SYNUCLEIN FIBRIL		EMD-60637	true		ELECTRON MICROSCOPY		9IJP		False	α-synuclein	37-99	37-99 (62)	3.1	P		P37840	1757688237696	99	37
Zhou, Y., Sokratian, A., Xu, E., Viverette, E., Dillard, L., Yuan, Y., Li, J.Y., Matarangas, A., Bouvette, J., Borgnia, M., Bartesaghi, A., West, A.		1757502955775	10.1101/2022.07.13.499896	2022-5-24	CryoEM structure of amplified alpha-synuclein fibril class B type I with extended core from DLB case X	DLB	EMD-27092	true		ELECTRON MICROSCOPY		8CZ3		True	α-synuclein	15-97	15-97 (82)	3.2	P	Amplfied from CSF	P37840	1757688237016	97	15
S.LOVESTAM, D.LI, S.H.W.SCHERES, M.GOEDERT		1756106173354	10.1038/s41586-023-06788-w	2023-8-2	TAU - AD-MIA3		EMD-18111	true		ELECTRON MICROSCOPY		8Q2K		False	Tau	305-379	305-379 (74)	2.88	P		P10636	1757688237195	379	305
Y.Q.TAO, Q.Y.ZHAO, C.LIU, D.LI		1757502955716		2022-7-31	PIB-BOUND ALPHA-SYNUCLEIN FIBRILS CONFORMATION 1		EMD-33967	true		ELECTRON MICROSCOPY		7YNO		False	α-synuclein	37-97	37-97 (60)	2.8	P		P37840	1757688236952	97	37
M.R.HOQ, S.R.BHARATH, F.S.VAGO, W.JIANG		1756106173466	10.1038/s41594-024-01252-3	2023-4-10	TYPE I BETA-AMYLOID 42 FILAMENTS FROM DOWN SYNDROME	Down Syndrome	EMD-40416	true		ELECTRON MICROSCOPY		8SEJ		True	Abeta42	9-42	9-42 (33)	3.17	P	frontal cortex	P05067	1757688237278	42	9
Boyer, D.R. Li, B. Sawaya, M.R. Jiang, L. Eisenberg, D.S.		1757502955453	10.1038/s41594-019-0322-y	2019-6-20	Cryo-EM structure of alpha-synuclein H50Q Wide Fibril		EMD-20331	true		ELECTRON MICROSCOPY	H50Q	6PES		False	α-synuclein	44-99	44-99 (55)	3.6	P		P37840	1757688236536	99	44
YAGI-UTSUMI, M., YANAKA, S., BURTON-SMITH, R.N., SONG, C., GANSER, C., YAMAZAKI, C., KASAHARA, H., SHIMAZU, T., UCHIHASHI, T., MURATA, K., KATO, K.		1756106173643	10.1021/acschemneuro.5c00217	2025-9-7	V-TYPE (V1-TYPE) AMYLOID FIBRIL (40) OF TOTTORI (D7N) MUTANT		EMD-63647	true		ELECTRON MICROSCOPY	D7N	9M5Q		False	Abeta40	13-39	13-39 (26)	3.3	P		P05067	1757688237717	39	13
Ozcan, K.A., Hoq, M.R., Bharath, S.R., Jiang, W.		1757502955672	10.1007/s00401-022-02461-0	2022-4-7	Structure of Type I Prion filaments from Gerstmann-Straussler-Scheinker disease	Gerstmann–Sträussler–Scheinker(GSS)	EMD-26607	true		ELECTRON MICROSCOPY	F198S	7UMQ		True	Prion Protein (PrP)	80-141	80-141 (61)	3.29	P	brain	P04156	1757688236836	141	80
Zhou, Y., Sokratian, A., Xu, E., Viverette, E., Dillard, L., Yuan, Y., Li, J.Y., Matarangas, A., Bouvette, J., Borgnia, M., Bartesaghi, A., West, A.		1757502955773	10.1101/2022.07.13.499896	2022-5-24	CryoEM structure of amplified alpha-synuclein fibril class B type I with extended core from DLB case VII	DLB	EMD-27089	true		ELECTRON MICROSCOPY		8CZ0		True	α-synuclein	15-97	15-97 (82)	2.9	P	Amplfied from CSF	P37840	1757688237014	97	15
Falcon, B. Zhang, W. Schweighauser, M. Murzin, A.G. Vidal, R. Garringer, H.J. Ghetti, B. Scheres, S.H.W. Goedert, M.		1625064960085	10.1007/s00401-018-1914-z	2018-9-26	Paired helical filament from sporadic Alzheimer's disease brain	Sporadic AD	EMD-0259	true		ELECTRON MICROSCOPY		6HRE		True	Tau	304-380	304-380 (76)	3.2	P	frontal cortex	P10636	1757688236474	380	304
HOQ, M.R., FERNANDEZ, A., VAGO, F.S., HALLINAN, G.I., BHARATH, S.R., LI, D., OZCAN, K.A., GARRINGER, H.J., JIANG, W., VIDAL, R., GHETTI, B.		1757502956120	10.1007/s00401-024-02786-y	2024-2-10	STRAIGHT HELICAL TAU FILAMENTS IN DOMINANTLY INHERITED ALZHEIMER DISEASE WITH COTTON WOOL PLAQUES	dominantly inherited AD	EMD-46420	true		ELECTRON MICROSCOPY		9CZL		True	Tau	305-378	305-378 (73)	3	P	cerebral cortex	P10636	1757688237457	378	305
A.B.NGUYEN, S.AFRIN, A.YAKUBOVSKA, L.SAELICES		1757502956112	10.1016/j.str.2024.09.021	2024-05-24	CRYO-EM STRUCTURE OF CARDIAC AMYLOID FIBRIL FROM A VARIANT ATTR V30M AMYLOIDOSIS PATIENT	ATTR	EMD-45074	true		ELECTRON MICROSCOPY	V30M	9BZS		True	Transthyretin (TTR)	11-123	11-123 (112)	3.14	P	Heart	P02766	1757688237415	123	11
Ferguson, N. Becker, J. Tidow, H. Tremmel, S. Sharpe, T.D. Krause, G. Flinders, J. Petrovich, M. Berriman, J. Oschkinat, H. Fersht, A.R.		1756106172606	10.1073/pnas.0607815103	2006-10-24	General structural motifs of amyloid protofilaments			true		SOLID-STATE NMR		2NNT		False	TCERG1	1-31	1-31 (30)	10	P		O14776	1757688236433	31	1
Frieg, B., Geraets, J.A., Schroeder, G.F.		1757502955534	10.1101/2021.07.09.451731	2021-6-28	PMCA-amplified alpha-synuclein fibril polymorph, Parkinson's Disease patient-derived seeds	PD	EMD-13123	true		ELECTRON MICROSCOPY		7OZG		True	α-synuclein	14-96	14-96 (82)	3.3	P	PMCA-aplified (Human amygdalas)	P37840	1757688236732	96	14
Xiaodan, N. Ryan, P.M. Jiansen, J. Jennifer, C.L.		1757502955433	10.1016/j.jmb.2019.07.001	2019-5-1	Cryo-EM structure of the N-terminally acetylated full length alpha-synuclein fibrils (Ac1-140)		EMD-20183	true		ELECTRON MICROSCOPY	N-TERMINALLY ACETYLATED	6OSJ		False	α-synuclein	37-97	37-97 (60)	2.8	P		P37840	1757688236533	97	37
C.QI, S.LOVESTAM, S.H.W.SCHERES, G.MICHEL		1756106173549	10.1038/s41594-025-01498-5	2024-3-14	PHF TYPE TAU FILAMENT FROM IN VITRO V337M MUTANT		EMD-19855	true		ELECTRON MICROSCOPY	V337M	9EOH		False	Tau	306-379	306-379 (73)	2.8	P		P10636	1757688237532	379	306
Cao, Q. Boyer, D.R. Sawaya, M.R. Eisenberg, D.S.		1625065019055	10.1038/s41594-019-0248-4	2018-11-14	SegB, conformation of TDP-43 low complexity domain segment A		EMD-0334	true		ELECTRON MICROSCOPY		6N3C		False	TDP43	288-319	288-319 (31)	3.3	P		Q13148	1757688236514	319	288
Abskharon, R., Sawaya, M.R., Boyer, D.R., Eisenberg, D.S.		1756106173032	10.1073/pnas.2119952119	2021-11-2	RNA-induced tau amyloid fibril		EMD-25364	true		ELECTRON MICROSCOPY		7SP1		False	Tau	391-426	391-426 (35)	3.4	P		P10636	1757688236821	426	391
Y.Q.TAO, Q.Y.ZHAO, C.LIU, D.LI		1757502955716	10.1073/pnas.2321633121	2022-7-31	BF227-BOUND ALPHA-SYNUCLEIN FIBRILS		EMD-33968	true		ELECTRON MICROSCOPY		7YNP		False	α-synuclein	37-97	37-97 (60)	2.8	P		P37840	1757688236952	97	37
Y.Q.TAO, C.LIU, D.LI		1756106173509		2024-6-13	HEPARIN BOUND TAU FIBRIL POLYMORPH 4		EMD-60533	true		ELECTRON MICROSCOPY		8ZWM		False	Tau	305-304	305-304 (-1)	3.2	P		P10636	1757688237333	304	305
S.LOVESTAM, D.LI, S.H.W.SCHERES, M.GOEDERT		1756106173426	10.1038/s41586-023-06788-w	2023-8-20	TAU - CTE-MIA10 (TAU INTERMEDIATE AMYLOID)		EMD-18272	true		ELECTRON MICROSCOPY		8Q99		False	Tau	308-378	308-378 (70)	2.7	P		P10636	1757688237237	378	308
Lovestam, S.K.A., Schweighauser, M., Scheres, S.H.W.		1757502955515	10.1002/2211-5463.13110	2021-1-28	Type 1B alpha-synuclein filament seeded in vitro by filaments purified from Multiple Systems Atrophy Case 1	MSA	EMD-12266	true		ELECTRON MICROSCOPY		7NCH		True	α-synuclein	14-91	14-91 (77)	3.84	P	Seeded by MSA (putamen)	P37840	1757688236677	91	14
Fritz, G. Faendrich, M. Schmidt, M. Radamaker, L.		1756106172687	10.1038/s41467-019-09032-0	2018-12-2	AL amyloid fibril from a lambda 1 light chain	Systemic AL amyloidosis	EMD-4452	true		ELECTRON MICROSCOPY		6IC3		True	lamda-IgLC	15-105	15-105 (90)	3.3	P	Heart muscle tissue		1757688236476	105	15
Fujiwara, T.	10022	1757502955291	10.1073/pnas.0607180103	2007-1-19	3D Structure of amyloid protofilaments of beta2-microglobulin fragment probed by solid-state NMR			true		SOLID-STATE NMR		2E8D		False	Beta-2 microglobulin	22-43	22-43 (21)	10	P		P61769	1757688236392	43	22
Zhou, Y., Sokratian, A., Xu, E., Viverette, E., Dillard, L., Yuan, Y., Li, J.Y., Matarangas, A., Bouvette, J., Borgnia, M., Bartesaghi, A., West, A.		1757502955762	10.1101/2022.07.13.499896	2022-5-24	CryoEM structures of amplified alpha-synuclein fibril class A type I with extended core from DLB case I	DLB	EMD-27084	true		ELECTRON MICROSCOPY		8CYT		True	α-synuclein	15-97	15-97 (82)	3	P	Amplfied from CSF	P37840	1757688237001	97	15
Lovestam, S., Scheres, S.H.W.		1756106173007	10.7554/eLife.76494	2021-12-19	in vitro assembled 266/297 - 391 tau filaments with MgCl2 and NaCl (14a)		EMD-14053	true		ELECTRON MICROSCOPY		7QKU		False	Tau	304-379	304-379 (75)	2.57	P		P10636	1757688236791	379	304
Falcon, B. Zivanov, J. Zhang, W. Murzin, A.G. Garringer, H.J. Vidal, R. Crowther, R.A. Newell, K.L. Ghetti, B. Goedert, M. Scheres, H.W.		1625064960095	10.1038/s41586-019-1026-5	2019-2-7	Chronic traumatic encephalopathy Type I Tau filament	chronic traumatic encephalopathy	EMD-0527	true		ELECTRON MICROSCOPY		6NWP		True	Tau	305-379	305-379 (74)	2.3	P	temporal cortex	P10636	1757688236531	379	305
Lovestam, S., Scheres, S.H.W.		1756106172992	10.7554/eLife.76494	2021-12-17	In vitro assembled 266/297 - 391 tau filaments with KCl (10a)		EMD-14038	true		ELECTRON MICROSCOPY		7QK5		False	Tau	306-379	306-379 (73)	1.92	P		P10636	1757688236776	379	306
B.FRIEG, M.HAN, K.GILLER, C.DIENEMANN, D.RIEDEL, S.BECKER, L.B.ANDREAS, C.GRIESINGER, G.F.SCHROEDER		1757502955897	10.1038/s41467-023-43822-x	2023-4-26	LIPIDIC AMYLOID-BETA(1-40) FIBRIL - POLYMORPH L1		EMD-17218	true		ELECTRON MICROSCOPY		8OVK		False	Abeta40	1-40	1-40 (39)	2.88	P		P05067	1757688237137	40	1
Lovestam, S., Scheres, S.H.W.		1756106173009	10.7554/eLife.76494	2021-12-19	In vitro assembled 266/297 - 391 tau filaments with MgSO4 and NaCl (15b)		EMD-14056	true		ELECTRON MICROSCOPY		7QKX		False	Tau	306-378	306-378 (72)	3.16	P		P10636	1757688236793	378	306
Yang, Y., Garringer, J.H., Shi, Y., Lovestam, S., Peak-Chew, S.Y., Zhang, X.J., Kotecha, A., Bacioglu, M., Koto, A., Takao, M., Spillantini, G.M., Ghetti, B., Vidal, R., Murzin, G.A., Scheres, H.W.S., Goedert, M.		1757502955754	10.1007/s00401-023-02550-8	2023-1-18	Cryo-EM structure of alpha-synuclein singlet filament from Juvenile-onset synucleinopathy	juvenile-onset synucleinopathy (JOS)	EMD-16188	true		ELECTRON MICROSCOPY		8BQV		True	α-synuclein	14-100	14-100 (86)	2	P	frontal cortex	P37840	1757688236993	100	14
D.ARSENI, B.RYSKELDI-FALCON		1757502956157	10.1038/s41586-024-08024-5	2024-6-12	STRUCTURE OF HETEROMERIC AMYLOID FILAMENT OF TDP-43 AND AXNA11 FROM FTLD-TDP TYPE C (VARIANT 1)	FTLD-TDP Type C	EMD-50628	true		ELECTRON MICROSCOPY		9FOR		True	Annexin-A11	284-74	284-74 (-210)	2.75	P	fresh-frozen prefrontal and temporal cortices	P50995	1757688237675	74	284
Lovestam, S., Schweighauser, M., Scheres, S.H.W.		1756106173014	10.1038/s41586-022-04650-z	2022-1-21	TMEM106B filaments with Fold I from Alzheimer's disease (case 1)	AD	EMD-14174	true		ELECTRON MICROSCOPY		7QVC		True	TMEM106B	120-254	120-254 (134)	2.64	P	frontal cortex	Q9NUM4	1757688236811	254	120
S.LOVESTAM, D.LI, S.H.W.SCHERES, M.GOEDERT		1756106173404	10.1038/s41586-023-06788-w	2023-8-18	TAU - AD-PHF LONG CROSSOVER		EMD-18255	true		ELECTRON MICROSCOPY		8Q8M		False	Tau	304-379	304-379 (75)	2.95	P		P10636	1757688237218	379	304
S.A.OOI, D.VALLI, M.MAJ		1757502956001		2023-10-18	CRYO-EM STRUCTURE OF HUMAN ISLET AMYLOID POLYPEPTIDE (HIAPP) MUTANT S29P, POLYMORPH 2		EMD-18672	true	https://chemrxiv.org/engage/api-gateway/chemrxiv/assets/orp/resource/item/67e5255a81d2151a02e96f8f/original/cryo-em-exposes-diverse-polymorphism-in-iapp-mutants-to-guide-rational-design-of-novel-therapeutics.pdf	ELECTRON MICROSCOPY	S29P	8QVQ		False	Islet amyloid polypeptide (IAPP)	13-37	13-37 (24)	4.07	P		P10997	1757688237261	37	13
