Authors	BMRB	CreatedAt	DOI	DepDate	Description	Disease	EMDB	IsPublic	Link	Method	Mutant	Name	PMID	Patient	Protein	Range	Residues	Resolution	RolePF	Tissue	UniprotId	UpdatedAt	resEnd	resStart
Yang, Y., Murzin, A.S., Peak-Chew, S.Y., Franco, C., Newell, K.L., Ghetti, B., Goedert, M., Scheres, S.H.W.		1756106173447	10.1186/s40478-023-01694-8	2023-9-25	Amyloid-beta 40 type 1 filament from the leptomeninges of individual with Alzheimer's disease and cerebral amyloid angiopathy	AD,CAA	EMD-18509	true		ELECTRON MICROSCOPY		8QN7		True	Abeta40	1-38	1-38 (37)	2.7	P	LEPTOMENINGES	P05067	1757688237259	38	1
Fitzpatrick, A.W.P. Falcon, B. He, S. Murzin, A.G. Murshudov, G. Garringer, H.G. Crowther, R.A. Ghetti, B. Goedert, M. Scheres, S.H.W.		1625064960049	10.1038/nature23002	2017-5-24	Paired helical filament in Alzheimer's disease brain	AD	EMD-3741	true		ELECTRON MICROSCOPY		5O3L		True	Tau	306-378	306-378 (72)	3.4	P	frontal and temporal cortex	P10636	1757688236450	378	306
Xiao, Y. Ma, B. McElheny, D. Parthasarathy, S. Long, F. Hoshi, M. Nussinov, R. Ishii, Y.	25429	1642675133454	10.1038/nsmb.2991	2015-1-14	42-Residue Beta Amyloid Fibril			true		SOLID-STATE NMR		2MXU		False	Abeta42	11-42	11-42 (31)	10	P		P05067	1757688236415	42	11
L.FREY, B.M.QURESHI, W.KWIATKOWSKI, D.RHYNER, J.GREENWALD, R.RIEK		1757502955912	10.7554/eLife.93562	2023-6-23	CRYO EM STRUCTURE OF THE TYPE 3D POLYMORPH OF ALPHA-SYNUCLEIN E46K MUTANT AT LOW PH.		EMD-17714	true		ELECTRON MICROSCOPY	E46K	8PJO		False	α-synuclein	36-98	36-98 (62)	2.31	P		P37840	1757688237153	98	36
WEI, Q., LIU, D., XIA, W., WANG, F., HUANG, L., ZHANG, J., WANG, X., XU, Z., HE, C., LI, W., SHI, X., WANG, C., LIU, Y., LIU, C., DONG, S.		1757502956191	10.1038/s41467-025-60978-w	2025-6-8	CRYO-EM STRUCTURE OF AMYLOID-BETA42-4B POLYMORPH 1		EMD-61944	true		ELECTRON MICROSCOPY	Y10 Β-GALNAC	9K0D		False	Abeta42	8-42	8-42 (34)	2.6	P		P05067	1757688237714	42	8
L.FREY, B.M.QURESHI, W.KWIATKOWSKI, D.RHYNER, J.GREENWALD, R.RIEK		1757502955912	10.7554/eLife.93562	2023-6-22	CRYO EM STRUCTURE OF THE TYPE 3C POLYMORPH OF ALPHA-SYNUCLEIN AT LOW PH.		EMD-17693	true		ELECTRON MICROSCOPY		8PIX		False	α-synuclein	33-97	33-97 (64)	3.41	P		P37840	1757688237152	97	33
S.LOVESTAM, D.LI, S.H.W.SCHERES, M.GOEDERT		1756106173430	10.1038/s41586-023-06788-w	2023-8-20	TAU - CTE-LIA3 (TAU INTERMEDIATE AMYLOID)		EMD-18279	true		ELECTRON MICROSCOPY		8Q9F		False	Tau	309-377	309-377 (68)	1.91	P		P10636	1757688237241	377	309
Sun, Y.P., Zhao, K., Liu, C., Li, D.		1757502955497	10.1038/s41467-020-20227-8	2020-4-17	Cryo-EM structure of amyloid fibril formed by hnRNPA1 low complexity domain		EMD-30235	true		ELECTRON MICROSCOPY		7BX7		False	HnRNPA1	251-295	251-295 (44)	2.8	P		P09651	1757688236651	295	251
Y.Q.TAO, C.LIU, D.LI		1757502956053	10.1073/pnas.2321633121	2024-6-13	POLYADENYLIC ACID BOUND ALPHA-SYNUCLEIN FIBRIL POLYMORPH 2		EMD-60530	true		ELECTRON MICROSCOPY		8ZWK		False	α-synuclein	37-99	37-99 (62)	3.4	P		P37840	1757688237331	99	37
Xia, W.C., Sun, Y.P., Liu, C.		1756106172866	10.1021/jacs.1c08607	2021-6-10	Cryo-EM structure of the fibril formed by disaccharide-modified amyloid-beta(1-42)		EMD-31428	true		ELECTRON MICROSCOPY	Y10 O-GLYCOSYLATION	7F29		False	Abeta42	6-42	6-42 (36)	3.1	P		P05067	1757688236655	42	6
Manka, S.W., Wenborn, A., Betts, J., Joiner, S., Saibil, H.R., Collinge, J., Wadsworth, J.D.F.		1757502955721	10.1038/s41589-022-01229-7	2022-5-26	Infectious mouse-adapted ME7 scrapie prion fibril purified from terminally-infected mouse brains	Prion	EMD-15043	true		ELECTRON MICROSCOPY		8A00		True	Prion Protein (PrP)	94-229	94-229 (135)	2.6	P	Mouse brain	P04925	1757688236957	229	94
B.A.NGUYEN, L.SAELICES		1757502955778	10.1038/s42003-024-06588-6	2022-8-23	CRYO-EM STRUCTURE OF WILD-TYPE TRANSTHYRETIN AMYLOID FROM HEART TISSUE	ATTR	EMD-26587	true		ELECTRON MICROSCOPY		8E7D		True	Transthyretin (TTR)	11-123	11-123 (112)	3.31	P	Heart	P02766	1757688237031	123	11
Shi, Y., Zhang, W., Yang, Y., Murzin, A.G., Falcon, B., Kotecha, A., van Beers, M., Tarutani, A., Kametani, F., Garringer, H.J., Vidal, R., Hallinan, G.I., Lashley, T., Saito, Y., Murayama, S., Yoshida, M., Tanaka, H., Kakita, A., Ikeuchi, T., Robinson, A.C., Mann, D.M.A., Kovacs, G.G., Revesz, T., Ghetti, B., Hasegawa, M., Goedert, M., Scheres, S.H.W.		1646823188554	10.1038/s41586-021-03911-7	2021-7-15	Argyrophilic grain disease type 1 tau filament	Argyrophilic grain disease (AGD)	EMD-13226	true		ELECTRON MICROSCOPY		7P6D		True	Tau	273-387	273-387 (114)	3.3	P	brain	P10636	1757688236756	387	273
Lovestam, S., Scheres, S.H.W.		1756106173005	10.7554/eLife.76494	2021-12-17	In vitro assembled 266/297 - 391 tau filaments with ZnCl2 (11a)		EMD-14046	true		ELECTRON MICROSCOPY		7QKL		False	Tau	304-379	304-379 (75)	2.07	P		P10636	1757688236781	379	304
Loerch, S. Rennegarbe, M. Liberta, F. Grigorieff, N. Fandrich, M. Schmidt, M.		1757502955397	10.1038/s41467-019-09033-z	2018-10-18	Cryo-EM structure of human AA amyloid fibril	Systemic AA amyloidosis	EMD-9232	true		ELECTRON MICROSCOPY		6MST		True	serum amyloid A (SAA)	2-55	2-55 (53)	2.7	P	Kidney tissue	P0DJI8	1757688236511	55	2
M.SCHWEIGHAUSER, A.G.MURZIN, J.MACDONALD, I.LAVENIR, R.A.CROWTHER, S.H.W.SCHERES, M.GOEDERT		1756106173424	10.1186/s40478-023-01658-y	2023-8-19	P301S TAU FILAMENTS FROM THE BRAINS OF TG2541 TRANSGENIC MOUSE LINE		EMD-18269	true		ELECTRON MICROSCOPY	P301S	8Q96		True	Tau	274-329	274-329 (55)	3.09	P		P10637	1757688237235	329	274
S.LOVESTAM, D.LI, S.H.W.SCHERES, M.GOEDERT		1756106173427	10.1038/s41586-023-06788-w	2023-8-20	TAU - CTE-MIA13 (TAU INTERMEDIATE AMYLOID)		EMD-18275	true		ELECTRON MICROSCOPY		8Q9B		False	Tau	305-379	305-379 (74)	3.1	P		P10636	1757688237238	379	305
Li, D., Zhang, X., Wang, Y., Zhu, P.		1757502955698	10.1016/j.isci.2022.105705	2022-7-25	Structure of hIAPP fibril at 3.6 Angstroms resolution		EMD-33897	true		ELECTRON MICROSCOPY		7YKW		False	Islet amyloid polypeptide (IAPP)	11-10	11-10 (-1)	3.6	P		P10997	1757688236920	10	11
Y.Q.TAO, C.LIU, D.LI		1757502956052	10.1073/pnas.2321633121	2024-6-13	CHONDROITIN SULFATE BOUND ALPHA-SYNUCLEIN FIBRIL		EMD-60528	true		ELECTRON MICROSCOPY		8ZWI		False	α-synuclein	37-97	37-97 (60)	3	P		P37840	1757688237316	97	37
S.LOVESTAM, D.LI, S.H.W.SCHERES, M.GOEDERT		1756106173444	10.1038/s41586-023-06788-w	2023-8-20	CTE TAU INTERMEDIATE AMYLOID (LIA-17)		EMD-18287	true		ELECTRON MICROSCOPY		8Q9O		False	Tau	305-379	305-379 (74)	3.1	P		P10636	1757688237255	379	305
Tycko, R., Lee, M., Yau, Y.-M., Louis, J.M.		1756106173228	10.1073/pnas.2218831120	2022-10-31	Brain-derived 42-residue amyloid-beta fibril type A	AD	EMD-28740	true		ELECTRON MICROSCOPY		8EZD		True	Abeta42	12-42	12-42 (30)	2.83	P	parietal lobe tissue	P05067	1757688237036	42	12
Lovestam, S., Scheres, S.H.W.		1756106173010	10.7554/eLife.76494	2021-12-19	In vitro assembled 305-379 tau filaments (27a)		EMD-14058	true		ELECTRON MICROSCOPY		7QKZ		False	Tau	307-317	307-317 (10)	2.65	P		P10636	1757688236794	317	307
Shi, Y., Ghetti, B., Goedert, M., Scheres, S.H.W.		1756106173191	10.1016/j.jmb.2023.168025	2022-12-13	Chronic traumatic encephalopathy tau filaments with PET ligand flortaucipir	PART-CTE	EMD-16329	true		ELECTRON MICROSCOPY		8BYN		True	Tau	305-379	305-379 (74)	2.6	P	hippocampus	P10636	1757688236995	379	305
X.XU, J.I.ANGERA, H.B.RAJEWSKI, W.JIANG, R.J.DEL VALLE		1756106173510	10.1038/s41557-025-01805-z	2024-03-18	FILAMENT OF TYPE 1 KD-MXYL MINIATURE TAU MACROCYCLE DERIVED FROM 4R TAUOPATHIC FOLD		EMD-44133	true		ELECTRON MICROSCOPY		9B3A		False	Tau	294-314	294-314 (20)	3.2	F		P10636	1757688237353	314	294
S.LOVESTAM, D.LI, S.H.W.SCHERES, M.GOEDERT		1756106173384	10.1038/s41586-023-06788-w	2023-8-16	TAU - AD-MIA7 (TAU INTERMEDIATE AMYLOID)		EMD-18224	true		ELECTRON MICROSCOPY		8Q7M		False	Tau	306-305	306-305 (-1)	3.26	P		P10636	1757688237198	305	306
S.LOVESTAM, D.LI, S.H.W.SCHERES, M.GOEDERT		1756106173432	10.1038/s41586-023-06788-w	2023-8-20	TAU - CTE-LIA7 (TAU INTERMEDIATE AMYLOID)		EMD-18283	true		ELECTRON MICROSCOPY		8Q9J		False	Tau	306-378	306-378 (72)	2.96	P		P10636	1757688237252	378	306
B.A.NGUYEN, L.SAELICES		1757502955780	10.1038/s41467-024-44820-3	2022-8-24	CRYO-EM STRUCTURE OF CARDIAC AMYLOID FIBRIL FROM A VARIANT ATTR I84S AMYLOIDOSIS PATIENT	ATTR	EMD-27323	true		ELECTRON MICROSCOPY	I84S	8E7J		True	Transthyretin (TTR)	12-122	12-122 (110)	3.1	P	Heart	P02766	1757688237034	122	12
L.Q.WANG, Y.Y.MA, M.Y.ZHANG, H.Y.YUAN, X.N.LI, K.ZHAO, J.CHEN, D.LI, Z.Z.WANG, W.D.LE, C.LIU, Y.LIANG		1757502955814		2023-2-23	CRYO-EM STRUCTURE OF AN AMYLOID FIBRIL FORMED BY ALS-CAUSING SOD1 MUTATION G85R		EMD-35459	true		ELECTRON MICROSCOPY	G85R	8IHU		False	Superoxide dismutase (SOD1) [cu-zn]	82-153	82-153 (71)	2.97	P		P00441	1757688237057	153	82
Lovestam, S., Schweighauser, M., Scheres, S.H.W.		1756106173025	10.1038/s41586-022-04650-z	2022-1-25	TMEM106B filaments with Fold IIb from Multiple system atrophy (case 19)	MSA	EMD-14188	true		ELECTRON MICROSCOPY		7QWL		True	TMEM106B	120-254	120-254 (134)	3.47	P	putamen	Q9NUM4	1757688236814	254	120
M.WILKINSON, Y.XU, R.GALLARDO, S.E.RADFORD, N.A.RANSON		1757502955740	10.1016/j.cell.2023.11.025	2022-9-5	IAPP S20G PLATEAU-PHASE FIBRIL POLYMORPH 4PF-CU		EMD-15754	true		ELECTRON MICROSCOPY	S20G	8AZ5		False	Islet amyloid polypeptide (IAPP)	11-37	11-37 (26)	2.3	P		P10997	1757688236978	37	11
Guerrero-Ferreira, R. Taylor, N.M.I. Arteni, A.A. Melki, R. Meier, B.H. Bockmann, A. Bousset, L. Stahlberg, H.		1757502955474	10.7554/eLife.48907	2019-9-9	cryo-em structure of alpha-synuclein fibril polymorph 2B		EMD-10305	true		ELECTRON MICROSCOPY		6SST		False	α-synuclein	14-96	14-96 (82)	3.4	P		P37840	1757688236554	96	14
Xiaodan, N., Ryan, P.M., Jiansen, J., Jennifer, C.L.		1757502955501	10.1073/pnas.2023487118	2021-1-10	Cryo-EM structure of the N-terminal alpha-synuclein truncation 41-140		EMD-23270	true		ELECTRON MICROSCOPY		7LC9		False	α-synuclein	61-60	61-60 (-1)	3.2	P		P37840	1757688236657	60	61
C.QI, S.YANG, S.H.W.SCHERES, M.GOEDERT		1757502955894	10.1073/pnas.2306767120	2023-4-20	AB TYPEII FILAMENT FROM GUAM ALS/PDC	Guam ALS/PDC	EMD-17177	true		ELECTRON MICROSCOPY		8OTF		True	Abeta42	12-42	12-42 (30)	3.3	P	Frontal cortex	P05067	1757688237133	42	12
Oda, T., Yanagisawa, H.		1757502956183	10.1038/s41467-025-61233-y	2024-10-1	G175S PMEL CAF AMYLOID - IN VITRO POLYMERIZED		EMD-61786	true		ELECTRON MICROSCOPY	G175S	9JSX		False	PMEL	149-182	149-182 (33)	1.79	P		P40967	1757688237714	182	149
D.THACKER, M.WILKINSON, K.M.DEWISON, N.A.RANSON, D.J.BROCKWELL, S.E.RADFORD		1757502955999	10.1073/pnas.2315006121	2023-10-3	CRYOEM STRUCTURE OF RECOMBINANT DELTAN7 ALPHA-SYNUCLEIN IN PBS		EMD-18570	true		ELECTRON MICROSCOPY	2-7 DELETION	8QPZ		False	α-synuclein	42-92	42-92 (50)	2.5	P		P37840	1757688237259	92	42
Tao, Y.Q., Sun, Y.P., Xia, W.C., Zhao, Q.Y., Liu, C., Li, D.		1757502955679	10.1038/s41467-022-31790-7	2021-8-12	Heparin-induced alpha-synuclein fibrils polymorph 3		EMD-31706	true		ELECTRON MICROSCOPY		7V4B		False	α-synuclein	14-99	14-99 (85)	3.1	P		P37840	1757688236841	99	14
Cao, Q., Jiang, Y., Sawaya, M.R., Eisenberg, D.S.		1756106173031	10.1038/s41586-022-04670-9	2021-9-23	Cryo-EM structure of TMEM106B fibrils extracted from a FTLD-TDP patient, polymorph 3	FTLD	EMD-24955	true		ELECTRON MICROSCOPY	N145,N151,N164,N183 GLYCOSYLATED	7SAS		True	TMEM106B	120-254	120-254 (134)	3.7	P	brain	Q9NUM4	1757688236820	254	120
V.BANERJEE, F.WANG, M.L.BAKER, I.I.SERYSHEVA, C.SOTO		1757502956022		2023-10-12	STRUCTURE OF AMPLIFIED ASYN FILAMENT BY USING SEED AMPLIFICATION ASSAY (SAA) FROM MSA PATIENT CSF.	MSA	EMD-42350	true		ELECTRON MICROSCOPY		8UKA		True	α-synuclein	36-96	36-96 (60)	3.9	P	Seeded by cerebrospinal fluid	P37840	1757688237292	96	36
Fan, Y., Sun, Y.P., Wang, J., Liu, C.		1757502955695	10.1016/j.str.2022.11.013	2022-4-30	Major polymorph in alpha-synuclein fibril seeded by cerebrospinal fluid from a mid-to-late stage (mid-PD-1) Parkinson's disease patient	PD	EMD-33333	true		ELECTRON MICROSCOPY		7XO1		True	α-synuclein	36-97	36-97 (61)	3	P	Seeded by cerebrospinal fluid	P37840	1757688236916	97	36
C.-H.LEE, J.-E.SAW, E.CHEN, C.-H.WANG, R.CHEN		1757502956033	10.1016/j.jmb.2024.168576	2023-11-02	CRYO-EM STRUCTURE OF THE HAMSTER PRION 23-144 FIBRIL AT PH 3.7		EMD-37963	true		ELECTRON MICROSCOPY		8WZX		False	Prion Protein (PrP)	94-144	94-144 (50)	2.88	P		P04273	1757688237294	144	94
Li, X., Liu, C.		1756106173129	10.1016/j.isci.2022.105645	2022-7-28	Cryo-EM structure of in vitro PHF fibril		EMD-33934	true		ELECTRON MICROSCOPY		7YMN		False	Tau	304-379	304-379 (75)	3.46	P		P10636	1757688236931	379	304
M.WILKINSON, Y.XU, R.GALLARDO, S.E.RADFORD, N.A.RANSON		1757502955738	10.1016/j.cell.2023.11.025	2022-9-5	IAPP S20G GROWTH-PHASE FIBRIL POLYMORPH 2PF-L		EMD-15728	true		ELECTRON MICROSCOPY	S20G	8AZ0		False	Islet amyloid polypeptide (IAPP)	10-37	10-37 (27)	3.4	P		P10997	1757688236976	37	10
R.N.BURTON-SMITH, K.MURATA		1756106173625	10.3390/ijms26031179	2024-06-21	J-SHAPED CONFORMER OF AMYLOID BETA (1-40)		EMD-60603	true		ELECTRON MICROSCOPY		9IIO		False	Abeta40	1-40	1-40 (39)	3.3	P		P05067	1757688237696	40	1
T.SCHULTE, V.SPERANZINI, A.CHAVES-SANJUAN, M.MILAZZO, S.RICAGNO		1756106173553	10.1038/s41467-024-50686-2	2024-5-10	CRYO-EM STRUCTURE OF CARDIAC COLLAGEN-ASSOCIATED AMYLOID AL59	AL amyloidosis	EMD-50270	true		ELECTRON MICROSCOPY		9FAA		True	lamda-IgLC	1-118	1-118 (117)	3.6	P	cardiac tissue		1757688237556	118	1
Fan, Y., Sun, Y.P., Wang, J., Liu, C.		1757502955695	10.1016/j.str.2022.11.013	2022-4-30	Minor polymorph in alpha-synuclein fibril seeded by cerebrospinal fluid from a mid-to-late stage (mid-PD-4) Parkinson's disease patient	PD	EMD-33334	true		ELECTRON MICROSCOPY		7XO2		True	α-synuclein	36-97	36-97 (61)	3	P	Seeded by cerebrospinal fluid	P37840	1757688236917	97	36
G.ANDREOTTI, M.SCHMIDT, M.FAENDRICH		1757502955873	10.1016/j.jmb.2024.168441	2023-4-11	AAPOAII AMYLOID FIBRIL MORPHOLOGY II (EX VIVO)	AApoAII	EMD-17104	true		ELECTRON MICROSCOPY		8OQ4		True	Apolipoprotein A-II	4-71	4-71 (67)	2.6	P	liver (seeded in SAMR1C mice)	P09813	1757688237115	71	4
M.ZIELINSKI, F.S.PERALTA REYES, L.GREMER, S.SCHEMMERT, B.FRIEG, A.WILLUWEIT, L.DONNER, M.ELVERS, L.N.G.NILSSON, S.SYVANEN, D.SEHLIN, M.INGELSSON, D.WILLBOLD, G.F.SCHROEDER		1756106173265	10.1038/s41593-023-01484-4	2023-3-30	MURINE TYPE II ABETA FIBRIL FROM APP23 MOUSE		EMD-16942	true		ELECTRON MICROSCOPY		8OL2		True	Abeta42	12-42	12-42 (30)	3	P	APP23	P05067	1757688237112	42	12
Fan, Y., Sun, Y.P., Wang, J., Liu, C.		1757502955678	10.1016/j.str.2022.11.013	2021-8-12	Type 4 alpha-synuclein fibril seeded by cerebrospinal fluid from a postmortal Parkinson's disease patient	PD	EMD-31704	true		ELECTRON MICROSCOPY		7V49		True	α-synuclein	36-95	36-95 (59)	3.4	P	cerebrospinal fluid	P37840	1757688236840	95	36
K.E.LIU, Y.Q.TAO, D.LI, C.LIU		1757502956038	10.1073/pnas.2321633121	2023-11-24	C05-03-BOUND E46K ALPHA-SYNUCLEIN FIBRILS		EMD-38108	true		ELECTRON MICROSCOPY	E46K	8X7R		False	α-synuclein	45-99	45-99 (54)	3	P		P37840	1757688237299	99	45
Tycko, R. Paravastu, A.	18131	1625063682447	10.1073/pnas.0806270105	2011-12-9	Structural Model for a 40-residue Beta-Amyloid Fibril with Three-Fold Symmetry, Negative Stagger			true		SOLID-STATE NMR		2LMQ		False	Abeta40	9-40	9-40 (31)	10	P		P05067	1757688236412	40	9
Roeder, C., Vettore, N., Mangels, L.N., Gremer, L., Ravelli, R.B.G., Willbold, D., Hoyer, W., Buell, A.K., Schroder, G.F.		1757502955471	10.1038/s41467-019-11320-8	2019-3-23	Cryo-EM Structure of the PI3-Kinase SH3 Domain Amyloid Fibril		EMD-4727	true		ELECTRON MICROSCOPY		6R4R		False	PI3K-SH3	1-77	1-77 (76)	3.4	P		P23727	1757688236551	77	1
Hervas, R., Rau, M.J., Park, Y., Zhang, W., Murzin, A.G., Fitzpatrick, J.A.J., Scheres, S.H.W., Si, K.		1625064753330	10.1126/science.aba3526	2020-2-4	Cryo-EM structure of the amyloid core of Drosophila Orb2 isolated from head		EMD-21316	true		ELECTRON MICROSCOPY		6VPS		True	Orb2	23-53	23-53 (30)	2.6	F	Adult fly head	Q9VSR3	1757688236632	53	23
Lovestam, S., Scheres, S.H.W.		1756106173004	10.7554/eLife.76494	2021-12-17	In vitro assembled 266/297 - 391 tau filaments with MgCl2 and NaCl (14b)		EMD-14044	true		ELECTRON MICROSCOPY		7QKJ		False	Tau	305-379	305-379 (74)	3.26	P		P10636	1757688236779	379	305
Yang, Y., Garringer, J.H., Shi, Y., Lovestam, S., Peak-Chew, S.Y., Zhang, X.J., Kotecha, A., Bacioglu, M., Koto, A., Takao, M., Spillantini, G.M., Ghetti, B., Vidal, R., Murzin, G.A., Scheres, H.W.S., Goedert, M.		1757502955757	10.1007/s00401-023-02550-8	2023-2-1	Type1 alpha-synuclein filament assembled in vitro by wild-type and mutant (7 residues insertion) protein		EMD-16600	true		ELECTRON MICROSCOPY	1:1 MIX WITH INSERTION MUTANT (MAAAEKT)	8CE7		False	α-synuclein	37-99	37-99 (62)	2.7	P		P37840	1757688236997	99	37
L.FREY, J.GREENWALD, R.RIEK		1757502956000	10.1038/s41467-024-52681-z	2023-10-17	CRYO-EM STRUCTURE OF THE HEAT-IRREVERSIBLE AMYLOID FIBRILS OF HEN EGG- WHITE LYSOZYME		EMD-18669	true		ELECTRON MICROSCOPY		8QV8		False	Lysozyme	26-100	26-100 (74)	3.26	P		P00698	1757688237260	100	26
Banerjee, S., Schmidt, M., Faendrich, M.		1757502955720	10.1038/s41467-022-34636-4	2022-4-13	Amyloid fibril from human systemic AA amyloidosis (vascular variant)	Systemic AA amyloidosis	EMD-14771	true		ELECTRON MICROSCOPY		7ZKY		True	serum amyloid A (SAA)	2-69	2-69 (67)	2.56	P	Kidney	P0DJI8	1757688236957	69	2
Bansal, A., Schmidt, M., Faendrich, M.		1757502955496	10.1038/s41467-021-21129-z	2020-6-11	Amyloid fibril morphology II (ex vivo) from murine SAA1.1 protein.	Systemic AA amyloidosis	EMD-11164	true		ELECTRON MICROSCOPY		6ZCH		True	serum amyloid A (SAA)	1-69	1-69 (68)	3.5	P	Liver tissue	P05367	1757688236641	69	1
Lovestam, S., Scheres, S.H.W.		1756106173005	10.7554/eLife.76494	2021-12-17	In vitro assembled 258-391 tau filaments with phosphoglycerate, 700 rpm (39a)		EMD-14045	true		ELECTRON MICROSCOPY		7QKK		False	Tau	304-379	304-379 (75)	2.8	P		P10636	1757688236780	379	304
HSIAO, L.C., LEE, C.H., MAZMANIAN, K., YOSHIDA, M., ITO, G., MURATA, T., UTSUNOMIYA-TATE, N., HAINO, T., TATE, S.I., HSU, S.D.		1757502956178		2025-03-26	CRYO-EM STRUCTURE OF THE CLASS I AMYLOID-BETA 42 FIBRIL CONTAINING A D-ASP AT POSITION 23		EMD-61302	true	https://doi.org/10.1016/j.jmb.2025.169092	ELECTRON MICROSCOPY	D-ASPARTATE 23	9JAZ		False	Abeta42	9-42	9-42 (33)	3	P		P05067	1757688237698	42	9
C.QI, S.YANG, S.H.W.SCHERES, M.GOEDERT		1756106173304	10.1073/pnas.2306767120	2023-4-20	CTE TYPEII TAU FILAMENT FROM GUAM ALS/PDC	Guam ALS/PDC	EMD-17174	true		ELECTRON MICROSCOPY		8OTC		True	Tau	305-379	305-379 (74)	3.2	P	frontal cortex,spinal cord	P10636	1757688237130	379	305
Shi, Y., Zhang, W., Yang, Y., Murzin, A.G., Falcon, B., Kotecha, A., van Beers, M., Tarutani, A., Kametani, F., Garringer, H.J., Vidal, R., Hallinan, G.I., Lashley, T., Saito, Y., Murayama, S., Yoshida, M., Tanaka, H., Kakita, A., Ikeuchi, T., Robinson, A.C., Mann, D.M.A., Kovacs, G.G., Revesz, T., Ghetti, B., Hasegawa, M., Goedert, M., Scheres, S.H.W.		1646823188492	10.1038/s41586-021-03911-7	2021-7-15	Globular glial tauopathy type 2 tau filament	Globular glial tauopathy (GGT)	EMD-13220	true		ELECTRON MICROSCOPY		7P67		True	Tau	272-379	272-379 (107)	3.1	P	brain	P10636	1757688236751	379	272
Lovestam, S., Scheres, S.H.W.		1756106173028	10.7554/eLife.76494	2022-2-10	In vitro assembled 266/297 - 391 tau filaments with KCl (10b)		EMD-14320	true		ELECTRON MICROSCOPY		7R5H		False	Tau	305-388	305-388 (83)	2.59	P		P10636	1757688236816	388	305
Y.Q.TAO, Q.Y.ZHAO, C.LIU, D.LI		1757502955812	10.1038/s41594-024-01407-2	2023-1-8	FORMED ALPHA-SYNUCLEIN FIBRILS AFTER INCUBATION WITH HEPARIN FOR 1 HOUR (HEP-REMOD-2)		EMD-35088	true		ELECTRON MICROSCOPY		8HZC		False	α-synuclein	14-99	14-99 (85)	3.2	P		P37840	1757688237056	99	14
Y.MA, K.ZHAO, C.LIU		1756106173494		2024-04-22	CRYO-EM STRUCTURE OF RIPK1 RHIM PFFS CROSS SEEDED RIPK3 RHIM AMYLOID FIBRIL		EMD-39854	true		ELECTRON MICROSCOPY		8Z94		False	RIPK3	448-469	448-469 (21)	4.56	P		Q9Y572	1757688237302	469	448
Lovestam, S., Scheres, S.H.W., Goedert, M.		1756106173283	10.1002/2211-5463.13657	2023-4-13	Cryo-EM structure of SH-SY5Y seeded with filaments from Alzheimer's Disease	AD	EMD-17121	true		ELECTRON MICROSCOPY		8ORE		True	Tau	273-380	273-380 (107)	2.5	P	occipital cortex	P10636	1757688237117	380	273
Hog, M.R.		1646823188377	10.1007/s00401-021-02336-w	2021-4-23	Paired helical tau filament extracted from PrP-CAA Patient brain tissue | tau filament | PHF Tau	PrP-CAA	EMD-23871	true		ELECTRON MICROSCOPY		7MKF		True	Tau	306-378	306-378 (72)	3	P	Frontol cortex brain tissue	P10636	1757688236673	378	306
C.QI, S.YANG, S.H.W.SCHERES, M.GOEDERT		1756106173305	10.1073/pnas.2306767120	2023-4-20	TMEM106B FOLD1-S FILAMENT FROM GUAM ALS/PDC	ALS/PDC	EMD-17175	true		ELECTRON MICROSCOPY		8OTD		True	TMEM106B	120-254	120-254 (134)	2.6	P	frontal cortex	Q9NUM4	1757688237131	254	120
Y.YANG, H.W.S.SCHERES, M.GOEDERT		1757502956119	10.1111/nan.70013	2024-7-30	CRYO-EM FILAMENT STRUCTURE IN FTLD-SYNUCLEIN	FTL/CBS in MSA	EMD-45979	true		ELECTRON MICROSCOPY		9CX6		True	α-synuclein	14-99	14-99 (85)	3.2	P	frontal cortex and subcortical white matter	P37840	1757688237455	99	14
M.STEINEBREI, M.SCHMIDT, M.FAENDRICH		1757502955914	10.1038/s41467-023-43301-3	2023-6-26	ATTRV20I AMYLOID FIBRIL FROM HEREDITARY ATTR AMLOIDOSIS	ATTR	EMD-17736	true		ELECTRON MICROSCOPY	V20I	8PKE		True	Transthyretin (TTR)	11-123	11-123 (112)	3.39	P	Heart	P02766	1757688237191	123	11
A.K.SCHUTZ, A.SORAGNI, S.HORNEMANN, A.AGUZZI, M.ERNST, A.BOCKMANN, B.H.MEIER	11064	1757502955292	10.1002/anie.201008276	2011-04-07	HADDOCK CALCULATED MODEL OF CONGO RED BOUND TO THE HET-S AMYLOID			true		SOLID-STATE NMR		2LBU		False	Het-s	225-295	225-295 (70)	4	F		Q03689	1757688236393	295	225
Lovestam, S., Scheres, S.H.W.		1756106172994	10.7554/eLife.76494	2021-12-17	In vitro assembled 258-391 tau filaments with phosphoglycerate, 700 rpm (39a)		EMD-14041	true		ELECTRON MICROSCOPY		7QKG		False	Tau	275-328	275-328 (53)	3.36	P		P10636	1757688236778	328	275
Li, Q., Babinchak, W.M., Surewicz, W.K.		1625065019067	10.1038/s41467-021-21912-y	2021-2-24	TDP-43 LCD amyloid fibrils		EMD-23059	true		ELECTRON MICROSCOPY		7KWZ		False	TDP43	276-414	276-414 (138)	3.2	P		Q13148	1757688236655	414	276
Glynn, C., Sawaya, M.R., Ge, P., Zhou, Z.H., Rodriguez, J.A.		1757502955478	10.1038/s41594-020-0403-y	2019-10-31	Human prion protein fibril, M129 variant		EMD-20900	true		ELECTRON MICROSCOPY		6UUR		False	Prion Protein (PrP)	106-145	106-145 (39)	3.5	P		P04156	1757688236578	145	106
SANCHEZ, J.C., PEREZ, R.M., BORCIK, C.G., GUARINO, D.S., DHAVALA, D.D., BAUMGARDT, J.K., SHAFFER, K.D., KOTZBAUER, P.T., MACH, R.H., RIENSTRA, C.M., PETERSSON, E.J., WRIGHT, E.R.		1757502956117	10.1101/2024.09.18.613698	2024-7-24	CRYO-EM STRUCTURE OF IN-VITRO ALPHA-SYNUCLEIN FIBRIL		EMD-45639	true		ELECTRON MICROSCOPY		9CK3		False	α-synuclein	15-97	15-97 (82)	2.04	P		P37840	1757688237451	97	15
Wu, K.-P., Huang, J.Y.-C.		1757502955682		2022-1-20	CryoEM structure of human alpha-synuclein A53T fibril		EMD-32636	true		ELECTRON MICROSCOPY	A53T	7WNZ		False	α-synuclein	36-100	36-100 (64)	3.4	P		P37840	1757688236854	100	36
Y.Q.TAO, Q.Y.ZHAO, C.LIU, D.LI		1757502955713	10.1073/pnas.2321633121	2022-7-30	CR-BOUND ALPHA-SYNUCLEIN FIBRILS		EMD-33961	true		ELECTRON MICROSCOPY		7YNG		False	α-synuclein	37-99	37-99 (62)	3.1	P		P37840	1757688236932	99	37
Yang, Y., Arseni, D., Zhang, W., Huang, M., Lovestam, S.K.A., Schweighauser, M., Kotecha, A., Murzin, A.G., Peak-Chew, S.Y., Macdonald, J., Lavenir, I., Garringer, H.J., Gelpi, E., Newell, K.L., Kovacs, G.G., Vidal, R., Ghetti, B., Falcon, B., Scheres, S.H.W., Goedert, M.		1646820844722	10.1126/science.abm7285	2021-11-1	Type II beta-amyloid 42 Filaments from Human Brain	familial AD	EMD-13809	true		ELECTRON MICROSCOPY		7Q4M		True	Abeta42	12-42	12-42 (30)	2.8	P	frontal cortex	P05067	1757688236758	42	12
K.E.LIU, Y.Q.TAO, D.LI, C.LIU		1757502956035	10.1073/pnas.2321633121	2023-11-24	CR-BOUND E46K ALPHA-SYNUCLEIN FIBRILS		EMD-38104	true		ELECTRON MICROSCOPY	E46K	8X7M		False	α-synuclein	45-99	45-99 (54)	3	P		P37840	1757688237297	99	45
Bansal, A., Schmidt, M., Faendrich, M.		1757502955495	10.1038/s41467-021-21129-z	2020-6-11	Amyloid fibril morphology ii (in vitro) from murine SAA1.1 protein		EMD-11163	true		ELECTRON MICROSCOPY		6ZCG		False	serum amyloid A (SAA)	1-37	1-37 (36)	2.95	P		P05367	1757688236640	37	1
Lovestam, S., Scheres, S.H.W.		1756106172994	10.7554/eLife.76494	2021-12-17	In vitro assembled 258-391 tau filaments with sodium azide, (41a)		EMD-14042	true		ELECTRON MICROSCOPY		7QKH		False	Tau	277-317	277-317 (40)	3.17	P		P10636	1757688236778	317	277
Yang, Y., Zhang, W.J., Murzin, A.G., Schweighauser, M., Huang, M., Lovestam, S.K.A., Peak-Chew, S.Y., Macdonald, J., Lavenir, I., Ghetti, B., Graff, C., Kumar, A., Nordber, A., Goedert, M., Scheres, S.H.W.		1756106173183	10.1007/s00401-022-02533-1	2022-10-27	Amyloid-beta 42 filaments extracted from the human brain with Arctic mutation (E22G) of Alzheimer's disease | ABeta42	AD	EMD-16022	true		ELECTRON MICROSCOPY		8BFZ		True	Abeta42	12-42	12-42 (30)	2.8	P	frontal cortex	P05067	1757688236990	42	12
Lovestam, S., Scheres, S.H.W.		1756106173012	10.7554/eLife.76494	2021-12-19	In vitro assembled 266/297 - 391 tau filaments with NaCl (8b)		EMD-14062	true		ELECTRON MICROSCOPY		7QL3		False	Tau	308-378	308-378 (70)	3.32	P		P10636	1757688236796	378	308
B.FRIEG, M.HAN, K.GILLER, C.DIENEMANN, D.RIEDEL, S.BECKER, L.B.ANDREAS, C.GRIESINGER, G.F.SCHROEDER		1757502955898	10.1038/s41467-023-43822-x	2023-4-28	LIPIDIC AMYLOID-BETA(1-40) FIBRIL - POLYMORPH L3-L3		EMD-17239	true		ELECTRON MICROSCOPY		8OWK		False	Abeta40	1-40	1-40 (39)	3.86	P		P05067	1757688237151	40	1
