Authors	BMRB	CreatedAt	DOI	DepDate	Description	Disease	EMDB	IsPublic	Link	Method	Mutant	Name	PMID	Patient	Protein	Range	Residues	Resolution	RolePF	Tissue	UniprotId	UpdatedAt	resEnd	resStart
Q.Y.ZHAO, Y.Q.TAO, C.LIU, D.LI		1756106173253		2023-8-13	THE CRYO-EM STRUCTURE OF TYPE1 AMYLOID BETA 42 FIBRIL.		EMD-37170	true		ELECTRON MICROSCOPY		8KEW		False	Abeta42	9-42	9-42 (33)	3.3	P		P05067	1757688237091	42	9
W.C.XIA, C.LIU		1757502956192	10.1016/j.neuron.2025.03.019	2024-10-17	CRYO-EM STRUCTURE OF ALPHA-SYNUCLEIN MINI S FIBRIL		EMD-61988	true		ELECTRON MICROSCOPY		9K23		False	α-synuclein	33-98	33-98 (65)	2.6	P		O55042	1757688237715	98	33
S.TETTER, B.RYSKELDI-FALCON		1756106173268	10.1038/s41586-023-06801-2	2023-4-3	TAF15 AMYLOID FOLD IN ATYPICAL FTLD - INDIVIDUAL 1	FTLD-FET	EMD-16999	true		ELECTRON MICROSCOPY		8ONS		True	TAF15	7-99	7-99 (92)	1.97	P	prefrontal and temporal cortices	Q92804	1756106173268	99	7
Shi, Y., Murzin, A.G., Falcon, B., Epstein, A., Machin, J., Tempest, P., Newell, K.L., Vidal, R., Garringer, H.J., Sahara, N., Higuchi, M., Ghetti, B., Jang, M., Scheres, S.H.W., Goedert, M.		1625064960190	10.1007/s00401-021-02294-3	2021-3-24	Conformation 1 of straight filament from primary age-related tauopathy brain	primary age-related tauopathy (PART)	EMD-12550	true		ELECTRON MICROSCOPY		7NRS		True	Tau	304-380	304-380 (76)	2.68	P	Hippocampus,frontal/occipital/entorhinal cortex	P10636	1757688236693	380	304
M.ZIELINSKI, F.S.PERALTA REYES, L.GREMER, S.SCHEMMERT, B.FRIEG, A.WILLUWEIT, L.DONNER, M.ELVERS, L.N.G.NILSSON, S.SYVANEN, D.SEHLIN, M.INGELSSON, D.WILLBOLD, G.F.SCHROEDER		1756106173266	10.1038/s41593-023-01484-4	2023-3-30	MurineArc type I Abeta fibril from tg-APPArcSwe mouse		EMD-16953	true		ELECTRON MICROSCOPY		8OL7		True	Abeta42	9-40	9-40 (31)	3	P	TG-APPARCSWE	P05067	1757688237113	40	9
Arakhamia, T., Lee, C.E., Carlomagno, Y., Duong, D.M., Kundinger, S.R., Wang, K., Williams, D., DeTure, M., Dickson, D.W., Cook, C.N., Seyfried, N.T., Petrucelli, L., Fitzpatrick, A.W.P.		1756106172767	10.1016/j.cell.2020.01.027	2020-1-11	Straight Filament from Alzheimer's Disease Human Brain Tissue	AD	EMD-0260	true		ELECTRON MICROSCOPY		6VI3		True	Tau	304-380	304-380 (76)	3.3	P	medial frontal cortex	P10636	1757688236631	380	304
Q.Y.ZHAO, Y.Q.TAO, F.YAN, C.LIU, D.LI		1756106173250		2023-4-27	THE CRYO-EM STRUCTURE OF FE3+ INDUCED ALPHA-SYN FIBRIL.		EMD-36043	true		ELECTRON MICROSCOPY		8J7N		False	TMEM106B	120-254	120-254 (134)	3	P		Q9NUM4	1757688237072	254	120
Arakhamia, T. Lee, C.E. Carlomagno, Y. Duong, D.M. Kundinger, S.R. Wang, K. Williams, D. DeTure, M. Dickson, D.W. Cook, C.N. Seyfried, N.T. Petrucelli, L. Fitzpatrick, A.W.P.		1625064960172	10.1016/j.cell.2020.01.027	2020-1-9	Singlet Tau Fibril from Corticobasal Degeneration Human Brain Tissue	corticobasal degeneration (CBD)	EMD-21201	true		ELECTRON MICROSCOPY		6VHA		True	Tau	274-380	274-380 (106)	4.3	P	medial frontal cortex	P10636	1757688236579	380	274
N.EL MAMMERI, A.J.DREGNI, P.DUAN, M.HONG		1756106173483	10.1073/pnas.2316175121	2023-8-14	PHF1-PHOSPHOMIMETIC TAU FILAMENTS (FULL-LENGTH, COFACTOR-FREE 0N4R TAU S396E, S400E, T403E, S404E)		EMD-41611	true		ELECTRON MICROSCOPY	S396E,S400E,T403E,S404E	8TTN		False	Tau	273-362	273-362 (89)	2.4	P		P10636	1757688237290	362	273
Roeder, C., Kupreichyk, T., Gremer, L., Schaefer, L.U., Pothula, K.R., Ravelli, R.B.G., Willbold, D., Hoyer, W., Schroder, G.F.		1757502955494	10.1038/s41594-020-0442-4	2020-2-11	Amyloid fibril structure of islet amyloid polypeptide		EMD-10669	true		ELECTRON MICROSCOPY		6Y1A		False	Islet amyloid polypeptide (IAPP)	13-37	13-37 (24)	4.2	P		P10997	1757688236638	37	13
C.QI, S.YANG, S.H.W.SCHERES, M.GOEDERT		1756106173286	10.1073/pnas.2306767120	2023-4-20	CTE TYPEI TAU FILAMENT FROM GUAM ALS/PDC	Guam ALS/PDC	EMD-17171	true		ELECTRON MICROSCOPY		8OT6		True	Tau	305-379	305-379 (74)	2	P	frontal cortex,spinal cord	P10636	1757688237121	379	305
Zhou, Y., Sokratian, A., Xu, E., Viverette, E., Dillard, L., Yuan, Y., Li, J.Y., Matarangas, A., Bouvette, J., Borgnia, M., Bartesaghi, A., West, A.		1757502955774	10.1101/2022.07.13.499896	2022-5-24	CryoEM structure of amplified alpha-synuclein fibril class B type II with extended core from DLB case VII	DLB	EMD-27090	true		ELECTRON MICROSCOPY		8CZ1		True	α-synuclein	15-97	15-97 (82)	3	P	Amplfied from CSF	P37840	1757688237015	97	15
M.SCHWEIGHAUSER, Y.SHI, A.G.MURZIN, H.J.GARRINGER, R.VIDAL, J.R.MURRELL, M.E.ERRO, H.SEELAAR, I.FERRER, J.C.VAN SWIETEN, B.GHETTI, S.H.W.SCHERES, M.GOEDERT		1756106173569	10.1038/s41594-025-01575-9	2024-8-12	P301L TAU FILAMENTS FROM HUMAN BRAIN	FTD	EMD-51319	true		ELECTRON MICROSCOPY	P301L	9GG0		True	Tau	271-377	271-377 (106)	2.81	P	Parietal cortex	P10636	1757688237676	377	271
Y.Q.TAO, Q.Y.ZHAO, C.LIU, D.LI		1757502955813	10.1038/s41594-024-01407-2	2023-1-9	FORMED ALPHA-SYNUCLEIN FIBRILS AFTER INCUBATION WITH HEPARIN FOR 3 DAYS (HEP-REMOD-3)		EMD-35090	true		ELECTRON MICROSCOPY		8HZS		False	α-synuclein	37-94	37-94 (57)	3.3	P		P37840	1757688237056	94	37
Y.Q.TAO, C.LIU, D.LI		1756106173508		2024-6-13	HEPARIN BOUND TAU FIBRIL POLYMORPH 3		EMD-60532	true		ELECTRON MICROSCOPY		8ZWL		False	Tau	304-379	304-379 (75)	3.4	P		P10636	1757688237332	379	304
Li, Y.W., Zhao, K., Liu, C., Li, X.		1757502955395	10.1038/s41467-020-16386-3	2019-10-21	Cryo-em structure of alpha-synuclein fiber mutation type E46K		EMD-0833	true		ELECTRON MICROSCOPY	E46K	6L4S		False	α-synuclein	45-99	45-99 (54)	3.37	P		P37840	1757688236493	99	45
Frieg, B., Geraets, J.A., Schroeder, G.F.		1757502955534	10.1101/2021.07.09.451731	2021-6-28	PMCA-amplified alpha-synuclein fibril polymorph, Multiple System Atrophy patient-derived seeds	MSA	EMD-13124	true		ELECTRON MICROSCOPY		7OZH		True	α-synuclein	36-93	36-93 (57)	3.02	P	PMCA-aplified (Human amygdalas)	P37840	1757688236732	93	36
Frieg, B., Antonschmidt, L., Dienemann, C., Geraets, J.A., Najbauer, E.E., Matthes, D., de Groot, B.L., Andreas, L.B., Becker, S., Griesinger, C., Schroeder, G.F.		1757502955721	10.1038/s41467-022-34552-7	2022-6-12	Lipidic alpha-synuclein fibril - polymorph L2A		EMD-15148	true		ELECTRON MICROSCOPY		8A4L		False	α-synuclein	14-96	14-96 (82)	2.68	P		P37840	1757688236958	96	14
Hoyt, F., Caughey, B.		1757502955781	10.1371/journal.ppat.1010947	2022-9-9	a22L prion fibril	Prion	EMD-28089	true		ELECTRON MICROSCOPY		8EFU		True	Prion Protein (PrP)	94-226	94-226 (132)	3.2	P	Mouse brain	P04925	1757688237036	226	94
R.BUECKER, C.SEURING, C.CAZEY, K.VEITH, M.GARCIA-ALAI, K.GRUENEWALD, M.LANDAU		1757502955599	10.1038/s41467-022-32039-z	2022-01-19	AMYLOID FIBRIL FROM THE ANTIMICROBIAL PEPTIDE AUREIN 3.3		EMD-14168	true		ELECTRON MICROSCOPY		7QV6		False	Aurein-3.3	1-17	1-17 (16)	3.5	F		P82396	1757688236810	17	1
K.SICKING, R.FERNANDEZ-BUSNADIEGO		1757502956174	10.1101/2025.02.07.25321793	2024-11-20	IN VITRO GROWN G14R ALPHA-SYNUCLEIN FIBRILS		EMD-52166	true		ELECTRON MICROSCOPY	G14R	9HGS		False	α-synuclein	12-100	12-100 (88)	3	P		P37840	1757688237695	100	12
G.M.ROSENBERG, M.R.SAWAYA, D.R.BOYER, P.GE, R.ABSKHARON, D.S.EISENBERG		1757502956020	10.1093/pnasnexus/pgad402	2023-07-06	TROPOMYOSIN-RECEPTOR KINASE FUSED GENE PROTEIN (TRK-FUSED GENE PROTEIN; TFG) LOW COMPLEXITY DOMAIN (RESIDUES 237-327) G269V MUTANT, AMYLOID FIBER		EMD-41195	true		ELECTRON MICROSCOPY	G269V	8TEQ		False	TRK-FUSED GENE PROTEIN (TFG)	265-264	265-264 (-1)	2.84	P		Q92734	1757688237281	264	265
Hog, M.R.		1646823188382	10.1007/s00401-021-02336-w	2021-4-23	Straight tau filament extracted from PrP-CAA Patient brain tissue | tau filament | SF Tau	PrP-CAA	EMD-23890	true		ELECTRON MICROSCOPY		7MKG		True	Tau	306-378	306-378 (72)	3.07	P	Frontol cortex brain tissue	P10636	1757688236674	378	306
B.FRIEG, M.HAN, K.GILLER, C.DIENEMANN, D.RIEDEL, S.BECKER, L.B.ANDREAS, C.GRIESINGER, G.F.SCHROEDER		1756106173324	10.1038/s41467-023-43822-x	2023-4-27	LIPIDIC AMYLOID-BETA(1-40) FIBRIL - POLYMORPH L2-L3		EMD-17235	true		ELECTRON MICROSCOPY		8OWE		False	Abetaa4	4-3	4-3 (-1)	3.75	P	recombinant	P05067	1756106173324	3	4
Sun, Y.P., Zhao, K., Liu, C.		1757502955498	10.1073/pnas.2012435118	2021-5-5	Cryo-EM structure of the hE46K cross-seeded hWT alpha-synuclein fibril		EMD-30269	true		ELECTRON MICROSCOPY	E46K	7C1D		False	α-synuclein	46-96	46-96 (50)	3.8	P		P37840	1757688236652	96	46
C.QI, M.HASEGAWA, M.TAKAO, M.SAKAI, M.AKAGI, Y.IWASAKI, M.YOSHIDA, S.H.W.SCHERES, M.GOEDERT		1756106173193	10.1186/s40478-023-01565-2	2023-1-24	STRUCTURE OF TAU FILAMENTS TYPE II FROM SUBACUTE SCLEROSING PANENCEPHALITIS	subacute sclerosing panencephalitis	EMD-16535	true		ELECTRON MICROSCOPY		8CAX		True	Tau	305-379	305-379 (74)	3.7	P	frontal cortex	P10636	1757688236996	379	305
Falcon, B. Zivanov, J. Zhang, W. Murzin, A.G. Garringer, H.J. Vidal, R. Crowther, R.A. Newell, K.L. Ghetti, B. Goedert, M. Scheres, H.W.		1625064960108	10.1038/s41586-019-1026-5	2019-2-7	Chronic traumatic encephalopathy Type II Tau filament	chronic traumatic encephalopathy	EMD-0528	true		ELECTRON MICROSCOPY		6NWQ		True	Tau	305-379	305-379 (74)	3.4	P	temporal cortex	P10636	1757688236532	379	305
M.STEINEBREI, M.SCHMIDT, M.FAENDRICH		1757502955932	10.1038/s41467-023-43301-3	2023-6-26	ATTRV122I AMYLOID FIBRIL FROM HEREDITARY ATTR AMLOIDOSIS	ATTR	EMD-17738	true		ELECTRON MICROSCOPY	V122I	8PKG		True	Transthyretin (TTR)	11-123	11-123 (112)	2.99	P	Heart	P02766	1757688237193	123	11
Zhao, Q.Y., Tao, Y.Q., Zhao, K., Tao, Y.Q., Li, D.		1757502955693	10.1016/j.jmb.2022.167680	2022-4-18	The cryo-EM structure of Fe3+ induced alpha-syn fibril		EMD-33236	true		ELECTRON MICROSCOPY		7XJX		False	α-synuclein	37-99	37-99 (62)	2.7	P		P37840	1757688236914	99	37
P.DUAN, N.EL MAMMERI		1756106173513	10.1016/j.jbc.2024.107326	2024-4-6	THF FILAMENT GENERATED FROM 4E-TAU(297-407) UNDER NEUTRAL MG2+ CONDITION		EMD-44421	true		ELECTRON MICROSCOPY	S396E,S400E,T403E,AND S404E	9BBL		False	Tau	307-379	307-379 (72)	2.5	P		P10636	1757688237376	379	307
Fitzpatrick, A.W.P. Falcon, B. He, S. Murzin, A.G. Murshudov, G. Garringer, H.G. Crowther, R.A. Ghetti, B. Goedert, M. Scheres, S.H.W.		1625064960054	10.1038/nature23002	2017-5-24	Pronase-treated paired helical filament in Alzheimer's disease brain	AD	EMD-3742	true		ELECTRON MICROSCOPY		5O3O		True	Tau	306-378	306-378 (72)	3.5	P	frontal and temporal cortex	P10636	1757688236451	378	306
G.M.ROSENBERG, M.R.SAWAYA, D.R.BOYER, P.GE, R.ABSKHARON, D.S.EISENBERG		1757502956020	10.1093/pnasnexus/pgad402	2023-07-06	TROPOMYOSIN-RECEPTOR KINASE FUSED GENE PROTEIN (TRK-FUSED GENE PROTEIN; TFG) LOW COMPLEXITY DOMAIN (RESIDUES 237-327) P285L MUTANT, AMYLOID FIBER		EMD-41198	true		ELECTRON MICROSCOPY	P285L	8TER		False	TRK-FUSED GENE PROTEIN (TFG)	265-299	265-299 (34)	2.59	P		Q92734	1757688237281	299	265
C.QI, S.H.W.SCHERES, G.MICHEL		1756106173548	10.1038/s41594-025-01498-5	2024-03-14	TF TYPE TAU FILAMENT FROM V337M MUTANT	FTD	EMD-19852	true		ELECTRON MICROSCOPY	V337M	9EOE		True	Tau	304-380	304-380 (76)	2.3	P	frontal cortex	P10636	1757688237517	380	304
X.XU, J.I.ANGERA, H.B.RAJEWSKI, W.JIANG, R.J.DEL VALLE		1756106173510	10.1038/s41557-025-01805-z	2024-03-18	TYPE 2 KD-MXYL FILAMENT OF MINIATURE TAU MACROCYCLE DERIVED FROM 4R TAUOPATHIC FOLD		EMD-44134	true		ELECTRON MICROSCOPY		9B3C		False	Tau	294-314	294-314 (20)	2.95	P		P10636	1757688237353	314	294
K.HOU, P.GE, M.R.SAWAYA, D.S.EISENBERG		1756106173512	10.1038/s41586-025-09244-z	2024-03-21	FILAMENT OF TAU IN COMPLEX WITH D-TLKIVWR, A D-PEPTIDE THAT DISAGGREGATES ALZHEIMER'S PAIRED HELICAL FILAMENTS, DETERMINED BY CRYO-EM	AD	EMD-44186	true		ELECTRON MICROSCOPY		9B4N		True	Tau	304-380	304-380 (76)	3.5	P	brain	P10636	1757688237373	380	304
B.A.NGUYEN, L.SAELICES		1757502956198			CRYO-EM STRUCTURE OF AMYLOID FIBRIL EXTRACTED FROM AAPOAI R173P AMYLOIDOSIS PATIENT	AApoAI		true		ELECTRON MICROSCOPY	R173P	9PW3		True	Apolipoprotein A-I	15-72	15-72 (57)	2.7	P	Kidney	P02647	1757688237752	72	15
Q.Y.ZHAO, Y.Q.TAO, C.LIU, D.LI		1756106173254		2023-8-15	THE CRYO-EM STRUCTURE OF TYPE3 AMYLOID BETA 42 FIBRIL.		EMD-37197	true		ELECTRON MICROSCOPY		8KF3		False	Abeta42	9-42	9-42 (33)	3.5	P		P05067	1757688237092	42	9
Zhang, W. Falcon, B. Murzin, A.G. Fan, J. Crowther, R.A. Goedert, M. Scheres, S.H.W.		1625064960129	10.7554/eLife.43584	2019-1-24	Cryo-EM structure of heparin-induced 2N4R tau twister filaments		EMD-4564	true		ELECTRON MICROSCOPY		6QJM		False	Tau	274-321	274-321 (47)	3.3	P		P10636	1757688236537	321	274
Q.Y.ZHAO, Y.FAN, W.B.ZHAO, D.LI, C.LIU		1756106173487		2023-11-17	THE CRYO-EM STRUCTURE OF TMEM106B AMYLOID FIBRIL IN PD PATIENT.	PD	EMD-38069	true		ELECTRON MICROSCOPY		8X5H		True	TMEM106B	120-254	120-254 (134)	3.47	P		Q9NUM4	1757688237295	254	120
L.S.RICHARDS, M.D.FLORES, S.ZINK, N.A.SCHIBROWSKY, M.R.SAWAYA, J.A.RODRIGUEZ		1756106173231	10.1016/j.str.2023.08.007	2023-2-6	CRYO-EM STRUCTURE OF RECOMBINANT HUMAN LECT2 AMYLOID FIBRIL CORE		EMD-29682	true		ELECTRON MICROSCOPY		8G2V		False	LECT2	55-75	55-75 (20)	2.71	P		O14960	1757688237040	75	55
Y.Q.TAO, Q.Y.ZHAO, C.LIU, D.LI		1757502955717	10.1073/pnas.2321633121	2022-7-31	PIB-BOUND ALPHA-SYNUCLEIN FIBRILS CONFORMATION 2		EMD-33967	true		ELECTRON MICROSCOPY		7YNQ		False	α-synuclein	37-97	37-97 (60)	2.8	P		P37840	1757688236953	97	37
C.QI, H.W.S.SCHERES, M.GOEDERT		1756106173552	10.1007/s00401-024-02741-x	2024-3-24	CTE TYPE III TAU FILAMENT FROM VACUOLAR TAUOPATHY	Vacuolar Tauopathy	EMD-19928	true		ELECTRON MICROSCOPY		9ERO		True	Tau	305-379	305-379 (74)	2.9	P	Frontal cortex	P10636	1757688237553	379	305
Shi, Y., Murzin, A.G., Falcon, B., Epstein, A., Machin, J., Tempest, P., Newell, K.L., Vidal, R., Garringer, H.J., Sahara, N., Higuchi, M., Ghetti, B., Jang, M., Scheres, S.H.W., Goedert, M.		1625064960195	10.1007/s00401-021-02294-3	2021-3-24	Conformation 2 of straight filament from primary age-related tauopathy brain	primary age-related tauopathy (PART)	EMD-12550	true		ELECTRON MICROSCOPY		7NRT		True	Tau	304-380	304-380 (76)	2.68	P	Hippocampus,frontal/occipital/entorhinal cortex	P10636	1757688236711	380	304
S.LOVESTAM, D.LI, S.H.W.SCHERES, M.GOEDERT		1756106173426	10.1038/s41586-023-06788-w	2023-8-20	TAU - CTE-MIA11 (TAU INTERMEDIATE AMYLOID)		EMD-18273	true		ELECTRON MICROSCOPY		8Q9A		False	Tau	303-380	303-380 (77)	3.04	P		P10636	1757688237237	380	303
K.NAGY-SMITH, E.MOORE, J.SCHNEIDER, R.TYCKO	25558	1756106172604	10.1073/pnas.1509313112	2015-03-30	MAX1 PEPTIDE FIBRIL			true		SOLID-STATE NMR		2N1E		False	Max1 peptide	1-20	1-20 (19)	20	F			1757688236432	20	1
Lovestam, S., Scheres, S.H.W.		1756106173011	10.7554/eLife.76494	2021-12-19	In vitro assembled 266-391 tau filaments in PBS (23a)		EMD-14060	true		ELECTRON MICROSCOPY		7QL1		False	Tau	306-378	306-378 (72)	3.34	P		P10636	1757688236795	378	306
L.FREY, B.M.QURESHI, W.KWIATKOWSKI, D.RHYNER, J.GREENWALD, R.RIEK		1757502955913	10.7554/eLife.93562	2023-6-24	CRYO EM STRUCTURE OF THE TYPE 1M POLYMORPH OF ALPHA-SYNUCLEIN		EMD-17723	true		ELECTRON MICROSCOPY		8PK2		False	α-synuclein	13-100	13-100 (87)	3.26	P		P37840	1757688237154	100	13
B.BARDIAUX, S.SULADZE, B.REIF	51867	1756106173465	10.1073/pnas.2401458121	2024-02-02	STRUCTURE OF FULL-LENGTH HUMAN INSULIN FIBRILS			true		SOLID-STATE NMR		8RVT		False	Insulin	1-21	1-21 (20)	10	P		P01308	1757688237276	21	1
D.S.EISENBERG, J.LU, P.GE, D.R.BOYER		1757502955780	10.1016/j.jbc.2023.105531	2022-9-1	HNRNPA2 D290V LCD PM3		EMD-28014	true		ELECTRON MICROSCOPY	D290V	8EC7		False	HnRNPA2	263-316	263-316 (53)	3.9	P		P22626	1757688237035	316	263
Shi, Y., Murzin, A.G., Falcon, B., Epstein, A., Machin, J., Tempest, P., Newell, K.L., Vidal, R., Garringer, H.J., Sahara, N., Higuchi, M., Ghetti, B., Jang, M., Scheres, S.H.W., Goedert, M.		1625064960213	10.1007/s00401-021-02294-3	2021-3-24	Straight filament from Alzheimer's disease with PET ligand APN-1607	AD	EMD-12552	true		ELECTRON MICROSCOPY		7NRX		True	Tau	304-380	304-380 (76)	3.55	P	Hippocampus,frontal/occipital/entorhinal cortex	P10636	1757688236712	380	304
S.LOVESTAM, D.LI, S.H.W.SCHERES, M.GOEDERT		1756106173409	10.1038/s41586-023-06788-w	2023-8-19	TAU - CTE-MIA5 (TAU INTERMEDIATE AMYLOID)		EMD-18264	true		ELECTRON MICROSCOPY		8Q8X		False	Tau	305-304	305-304 (-1)	2.54	P		P10636	1757688237231	304	305
S.LOVESTAM, D.LI, S.H.W.SCHERES, M.GOEDERT		1756106173403	10.1038/s41586-023-06788-w	2023-8-18	TAU - AD-LIA7 (TAU INTERMEDIATE AMYLOID)		EMD-18254	true		ELECTRON MICROSCOPY		8Q8L		False	Tau	304-379	304-379 (75)	3.04	P		P10636	1757688237218	379	304
Lovestam, S., Scheres, S.H.W.		1756106172990	10.7554/eLife.76494	2021-12-17	In vitro assembled 297-394 tau filaments in PBS (35d)		EMD-14028	true		ELECTRON MICROSCOPY		7QK1		False	Tau	305-379	305-379 (74)	3.03	P		P10636	1757688236774	379	305
M.ZIELINSKI, F.S.PERALTA REYES, L.GREMER, M.PAGNON DE LA VEGA, C.ROEDER, T.V.HEIDLER, S.SYVAENEN, D.WILLBOLD, D.SEHLIN, M.INGELSSON, G.F.SCHROEDER		1756106173566		2024-05-26	CRYO-EM STRUCTURE OF TAU FILAMENTS FROM INDIVIDUALS CARRYING THE UPPSALA ABETAUPP(1-42)DELTA(19-24) MUTATION		EMD-50441	true		ELECTRON MICROSCOPY	UPPSALLA MUTATION	9FH6		True	Tau	306-378	306-378 (72)	3.3	P		P10636	1757688237577	378	306
YAGI-UTSUMI, M., YANAKA, S., BURTON-SMITH, R.N., SONG, C., GANSER, C., YAMAZAKI, C., KASAHARA, H., SHIMAZU, T., UCHIHASHI, T., MURATA, K., KATO, K.		1756106173643	10.1021/acschemneuro.5c00217	2025-9-7	ES-TYPE (SHORT PITCH) AMYLOID FIBRIL (40) OF TOTTORI (D7N) MUTANT		EMD-63648	true		ELECTRON MICROSCOPY	D7N	9M5R		False	Abeta40	17-39	17-39 (22)	3.6	P		P05067	1757688237717	39	17
Lu, J., Cao, Q., Hughes, M.P., Sawaya, M.R., Boyer, D.R., Cascio, D., Eisenberg, D.S.		1757502955482	10.1038/s41467-020-17905-y	2020-4-29	hnRNPA2 Low complexity domain (LCD) determined by cryoEM		EMD-21871	true		ELECTRON MICROSCOPY		6WQK		False	HnRNPA2	263-319	263-319 (56)	3.1	P		P22626	1757688236634	319	263
Shi, Y., Zhang, W., Yang, Y., Murzin, A.G., Falcon, B., Kotecha, A., van Beers, M., Tarutani, A., Kametani, F., Garringer, H.J., Vidal, R., Hallinan, G.I., Lashley, T., Saito, Y., Murayama, S., Yoshida, M., Tanaka, H., Kakita, A., Ikeuchi, T., Robinson, A.C., Mann, D.M.A., Kovacs, G.G., Revesz, T., Ghetti, B., Hasegawa, M., Goedert, M., Scheres, S.H.W.		1646823188456	10.1038/s41586-021-03911-7	2021-7-15	Progressive supranuclear palsy tau filament	Progressive supranuclear palsy (PSP)	EMD-13218	true		ELECTRON MICROSCOPY		7P65		True	Tau	272-381	272-381 (109)	2.7	P	brain	P10636	1757688236733	381	272
M.ZIELINSKI, F.S.PERALTA REYES, L.GREMER, M.PAGNON DE LA VEGA, C.ROEDER, T.V.HEIDLER, S.SYVAENEN, D.WILLBOLD, D.SEHLIN, M.INGELSSON, G.F.SCHROEDER		1757502956153		2024-05-26	CRYO-EM STRUCTURE OF AMYLOID-BETA FIBRILS FROM MOUSE BRAIN CARRYING THE UPPSALA ABETAUPP(1-42)DELTA(19-24) MUTATION		EMD-50436	true		ELECTRON MICROSCOPY	UPPSALA MUTATION	9FH1		True	Abeta42	14-42	14-42 (28)	3.2	P		Q60495	1757688237574	42	14
Gallardo, R.U., Iadanza, M.G., Ranson, N.A., Radford, S.E.		1757502955496	10.1038/s41594-020-0496-3	2020-7-13	amyloid structure of amylin (IAPP - islet amyloid polypeptide)		EMD-11380	true		ELECTRON MICROSCOPY		6ZRF		False	Islet amyloid polypeptide (IAPP)	13-36	13-36 (23)	3.6	P		P10997	1757688236642	36	13
C.QI, H.W.S.SCHERES, M.GOEDERT		1756106173551	10.1007/s00401-024-02741-x	2024-3-24	CTE TYPE II TAU FILAMENT FROM VACUOLAR TAUOPATHY	Vacuolar Tauopathy	EMD-19927	true		ELECTRON MICROSCOPY	D395G	9ERN		True	Tau	305-379	305-379 (74)	2.5	P	Frontal and temporal cortices	P10636	1757688237551	379	305
Cao, Q., Boyer, D.R., Sawaya, M.R., Eisenberg, D.S.		1757502955482	10.1038/s41594-020-0435-3	2020-2-18	Cryo-EM structure of human islet amyloid polypeptide (hIAPP, or amylin) fibrils		EMD-21410	true		ELECTRON MICROSCOPY		6VW2		False	Islet amyloid polypeptide (IAPP)	14-37	14-37 (23)	3.4	P		P10997	1757688236633	37	14
Tao, Y.Q., Sun, Y.P., Xia, W.C., Zhao, Q.Y., Liu, C., Li, D.		1757502955678	10.1038/s41467-022-31790-7	2021-8-12	Heparin-induced alpha-synuclein fibrils polymorph 1		EMD-31705	true		ELECTRON MICROSCOPY		7V4A		False	α-synuclein	14-99	14-99 (85)	3.2	P		P37840	1757688236841	99	14
Lovestam, S.K.A., Schweighauser, M., Scheres, S.H.W.		1757502955514	10.1002/2211-5463.13110	2021-2-24	Type 2A alpha-synuclein filament seeded in vitro by filaments purified from Multiple Systems Atrophy Case 2	MSA	EMD-12265	true		ELECTRON MICROSCOPY		7NCG		True	α-synuclein	37-97	37-97 (60)	3.43	P	Seeded by MSA (putamen)	P37840	1757688236676	97	37
L.FREY, B.M.QURESHI, W.KWIATKOWSKI, D.RHYNER, J.GREENWALD, R.RIEK		1757502956158	10.7554/eLife.93562	2024-7-3	CRYO EM STRUCTURE OF THE TYPE 3B POLYMORPH OF ALPHA-SYNUCLEIN AT LOW PH.		EMD-50888	true		ELECTRON MICROSCOPY		9FYP		False	α-synuclein	35-98	35-98 (63)	2.23	P		P37840	1757688237676	98	35
Oda, T., Yanagisawa, H.		1757502956182	10.1038/s41467-025-61233-y	2024-10-1	G175S MUTANT NATIVE PMEL AMYLOID	pigment dispersion syndrome (PDS)	EMD-61784	true		ELECTRON MICROSCOPY	G175S	9JSV		True	PMEL	149-182	149-182 (33)	1.79	P	Isolated from melenoma cells	P40967	1757688237713	182	149
K.SHARMA, J.SHENOY, A.LOQUET, M.SCHMIDT, M.FAENDRICH		1756106173451	10.1038/s41467-023-44489-0	2023-10-24	TDP-43 AMYLOID FIBRILS: MORPHOLOGY-2		EMD-18717	true		ELECTRON MICROSCOPY		8QXB		False	TDP43	304-348	304-348 (44)	3.86	P		Q13148	1757688237271	348	304
Tao, Y.Q., Zhao, Q.Y., Liu, C., Li, D.		1757502955682	10.1073/pnas.2321633121	2022-1-15	alpha-synuclein fibril-F0502B complex		EMD-32615	true		ELECTRON MICROSCOPY		7WMM		False	α-synuclein	37-97	37-97 (60)	2.6	P		P37840	1757688236853	97	37
S.LOVESTAM, D.LI, S.H.W.SCHERES, M.GOEDERT		1756106173390	10.1038/s41586-023-06788-w	2023-8-18	TAU - AD-LIA5 (TAU INTERMEDIATE AMYLOID)		EMD-18253	true		ELECTRON MICROSCOPY		8Q8F		False	Tau	304-379	304-379 (75)	2.93	P		P10636	1757688237217	379	304
Liu, C., Li, Y.M., Zhao, K., Lim, Y.J., Liu, Z.Y.		1757502955393	10.1073/pnas.1922741117	2019-9-30	Cryo-EM structure of phosphorylated Tyr39 a-synuclein amyloid fibril		EMD-0803	true		ELECTRON MICROSCOPY	Y39PY	6L1U		False	α-synuclein	1-100	1-100 (99)	3.37	P		P37840	1757688236491	100	1
Fan, Y., Sun, Y.P., Wang, J., Liu, C.		1757502955798	10.1016/j.str.2022.11.013	2022-9-28	Major polymorph in alpha-synuclein fibril seeded by cerebrospinal fluid from a postmortal Parkinson's disease patient	PD	EMD-31703	true		ELECTRON MICROSCOPY		8H04		True	α-synuclein	36-98	36-98 (62)	3	P	Seeded by cerebrospinal fluid	P37840	1757688237053	98	36
Wilkinson, M., Gallardo, R., Radford, S.E., Ranson, N.A.		1757502955731	10.1038/s41467-023-36791-8	2022-6-21	beta-2-microglobulin DeltaN6 amyloid fibril form 2PFb		EMD-15223	true		ELECTRON MICROSCOPY	N6 DELETION	8A7P		False	Beta-2 microglobulin	6-92	6-92 (86)	3.4	P		P61769	1757688236960	92	6
S.LOVESTAM, D.LI, S.H.W.SCHERES, M.GOEDERT		1756106173407	10.1038/s41586-023-06788-w	2023-8-18	TAU - CTE-MIA3		EMD-18262	true		ELECTRON MICROSCOPY		8Q8V		False	Tau	305-379	305-379 (74)	3.8	P		P10636	1757688237221	379	305
KAWABATA, H., LI, Y., LIN, Y., ISHIMOTO, N., YUN, Y., HEO, Y., PARK, J.H., LEE, Y.H., PARK, S.Y.		1757502956176		2025-6-8	CRYO-EM STRUCTURE OF LYSOZYME TYPE 1 AMYLOID FIBRILS		EMD-61056	true		ELECTRON MICROSCOPY		9J0L		False	Lysozyme	5-129	5-129 (124)	2.29	P		P00698	1757688237697	129	5
M.R.HOQ, F.S.VAGO, S.R.BHARATH, W.JIANG		1756106173467	10.1038/s41594-024-01252-3	2023-4-10	TYPE IIIA BETA-AMYLOID 40 FILAMENTS FROM DOWN SYNDROME	Down Syndrome	EMD-40419	true		ELECTRON MICROSCOPY		8SEK		True	Abeta40	9-40	9-40 (31)	3.5	P	frontal cortex	P05067	1757688237278	40	9
Frieg, B., Antonschmidt, L., Dienemann, C., Geraets, J.A., Najbauer, E.E., Matthes, D., de Groot, B.L., Andreas, L.B., Becker, S., Griesinger, C., Schroeder, G.F.		1757502955735	10.1038/s41467-022-34552-7	2022-7-11	Lipidic alpha-synuclein fibril - polymorph L1A	PD	EMD-15370	true		ELECTRON MICROSCOPY		8ADU		False	α-synuclein	1-99	1-99 (98)	3.24	P		P37840	1757688236973	99	1
S.A.OOI, D.VALLI, M.MAJ		1757502955997		2023-09-12	CRYO-EM STRUCTURE OF HUMAN ISLET AMYLOID POLYPEPTIDE (HIAPP) MUTANT A25P, POLYMORPH 1		EMD-18441	true	https://chemrxiv.org/engage/chemrxiv/article-details/67e5255a81d2151a02e96f8f	ELECTRON MICROSCOPY	A25P	8QJ1		False	Islet amyloid polypeptide (IAPP)	2-37	2-37 (35)	3.06	P		P10997	1757688237257	37	2
M.ENOMOTO, I.MARTINEZ-VALBUENA, S.L.FORREST, X.XU, R.MUNHOZ, J.LI, E.ROGAEVA, A.E.LANG, G.G.KOVACS		1757502956196	10.1038/s42003-025-08355-7	2025-04-23	CRYO-EM STRUCTURE OF ALPHA-SYNUCLEIN FILAMENTS DERIVED FROM THE FRONTAL CORTEX OF THE CASE OF ATYPICAL MULTIPLE SYSTEM ATROPHY	MSA	EMD-70295	true		ELECTRON MICROSCOPY		9OBP		True	α-synuclein	14-100	14-100 (86)	2.5	P	Frontol cortex	P37840	1757688237750	100	14
Lovestam, S., Scheres, S.H.W.		1646823188573	10.7554/eLife.76494	2021-12-17	In vitro assembled tau filaments with structures like chronic traumatic encephalopathy type II (8a)		EMD-14024	true		ELECTRON MICROSCOPY		7QJW		False	Tau	305-379	305-379 (74)	2.81	P		P10636	1757688236771	379	305
S.ANSARI, Y.LI, K.K.FREDERICK		1757502956118	10.1101/2024.09.09.612142	2024-07-09	CRYO-EM STRUCTURE OF ACETYLATED ALPHA-SYNUCLEIN A53T FIBRIL - POLYMORPH A		EMD-45650	true		ELECTRON MICROSCOPY	A53T,N-TERM ACETYLATIION	9CKK		False	α-synuclein	15-92	15-92 (77)	2.21	P		P37840	1757688237452	92	15
Zhang, W. Murzin, A.G. Falcon, B. Shi, Y. Goedert, M. Scheres, S.H.W.		1625064960145	10.1038/s41586-020-2043-0	2019-11-26	Cryo-EM structure of TypeI tau filaments extracted from the brains of individuals with Corticobasal degeneration	corticobasal degeneration (CBD)	EMD-10512	true		ELECTRON MICROSCOPY		6TJO		True	Tau	274-380	274-380 (106)	3.2	P	frontal cortex	P10636	1757688236557	380	274
